rotten_tomatoes_link,review_content,movie_title,genre_list
m/1212694-blind_side,It's so clichd and so patronising and there's more than a whiff of racism.,The Blind Side,"['Comedy', 'Drama', 'Sports & Fitness']"
m/1212694-blind_side,"Some situations seem very contrived, but ultimately there's no doubting that Bullock has created a memorable character in Leigh Anne.",The Blind Side,"['Comedy', 'Drama', 'Sports & Fitness']"
m/1212694-blind_side,"The Blind Side is a big budget, well crafted and finely honed... movie of the week.",The Blind Side,"['Comedy', 'Drama', 'Sports & Fitness']"
m/1212694-blind_side,The fact that The Blind Side is a terrible movie must be approached gingerly.,The Blind Side,"['Comedy', 'Drama', 'Sports & Fitness']"
m/1212694-blind_side,Cannot be denied its to-be-reckoned-with sincerity.,The Blind Side,"['Comedy', 'Drama', 'Sports & Fitness']"
m/1212694-blind_side,"Un drama sencillo y humano, inspirado en una historia real, cuyo principal atractivo es Sandra Bullock en un ligero cambio de tono. No es el primer drama en el que participa, pero s su labor dramtica ms convincente hasta la fecha.",The Blind Side,"['Comedy', 'Drama', 'Sports & Fitness']"
m/1212694-blind_side,"Whether the movie was worthy of Oscar consideration is another matter, but there is little doubt it is uplifting and inspirational.",The Blind Side,"['Comedy', 'Drama', 'Sports & Fitness']"
m/1212694-blind_side,Hancock tugs at the heart strings and wrings the tear ducts with the same ruthless efficiency as a Superbowl playbook.,The Blind Side,"['Comedy', 'Drama', 'Sports & Fitness']"
m/1212694-blind_side,"With far less potential than Precious, superior production values and the willingness to tell the story in a straightforward way prove to be the right formula.",The Blind Side,"['Comedy', 'Drama', 'Sports & Fitness']"
m/1212694-blind_side,It pushed my outrage buttons like no movie since those Ghetto-bots in Transformers 2 admitted they didn't know how to read.,The Blind Side,"['Comedy', 'Drama', 'Sports & Fitness']"
m/1212694-blind_side,"The movie's obsessed with the Tuohy clan's constant kindness towards Mike, and the social knock-on effects for them. But it barely gives a second thought to the poor sod's own struggle with suddenly finding himself a charity case.",The Blind Side,"['Comedy', 'Drama', 'Sports & Fitness']"
m/1212694-blind_side,"Bullock is certainly likable, but the fact that her performance (let alone the movie itself) is considered Oscar-worthy is ludicrous.",The Blind Side,"['Comedy', 'Drama', 'Sports & Fitness']"
m/1212694-blind_side,It does the crowd-pleasing act almost perfectly.,The Blind Side,"['Comedy', 'Drama', 'Sports & Fitness']"
m/1212694-blind_side,"Bullock has pulled a blinder herself. It's a doughty performance, and worth singling out.",The Blind Side,"['Comedy', 'Drama', 'Sports & Fitness']"
m/1212694-blind_side,"Bullock turns in a terrific, ball-breaking performance. Unfortunately, the rest of the film is painfully patronising.",The Blind Side,"['Comedy', 'Drama', 'Sports & Fitness']"
m/1212694-blind_side,"You have to keep reminding yourself that The Blind Side is based on real events. It seems much more like a cannily concocted, sugar-coated fairytale designed to inspire and uplift.",The Blind Side,"['Comedy', 'Drama', 'Sports & Fitness']"
m/1212694-blind_side,"Here is a movie that honours a downtrodden financial, racial and political minority: rich, white southern Republicans who carry guns and aren't afraid to threaten black people with them.",The Blind Side,"['Comedy', 'Drama', 'Sports & Fitness']"
m/1212694-blind_side,"Shows that America, for all its loudhailed Christianity, doesn't really need God at all. It just needs Sandra Bullock and her like.",The Blind Side,"['Comedy', 'Drama', 'Sports & Fitness']"
m/1212694-blind_side,"It's all a bit too pat and convenient, and sadly, a little bit racist.",The Blind Side,"['Comedy', 'Drama', 'Sports & Fitness']"
m/1212694-blind_side,"A few momentary hiccups aside, the film plays out in sickly-sweet fashion, relentlessly shoving the Touhy's self-righteous values down the audiences' throat and never bothering to consider the wider social ramifications...",The Blind Side,"['Comedy', 'Drama', 'Sports & Fitness']"
m/1212694-blind_side,"Oher's miserable start in life shouldn't have happened, but it did -- and The Blind Side is a film that shouldn't work, but does.",The Blind Side,"['Comedy', 'Drama', 'Sports & Fitness']"
m/1212694-blind_side,"It's clumsy, obvious film-making but then if you buy into it, well, it's kind of lovably basic in its emotional button pushing.",The Blind Side,"['Comedy', 'Drama', 'Sports & Fitness']"
m/1212694-blind_side,"It's a celluloid version of Paul McCartney and Stevie's Wonder's Ebony and Ivory, one in which pious, infantilizing didacticism masquerades as humanitarianism.",The Blind Side,"['Comedy', 'Drama', 'Sports & Fitness']"
m/1212694-blind_side,"You will be moved, but at the price of any nuance or complexity.",The Blind Side,"['Comedy', 'Drama', 'Sports & Fitness']"
m/1212694-blind_side,"Quite how Sandra Bullock deserved an Oscar for her one-note turn as bleached supermum Leigh-Anne is a mystery, since it transforms a potentially worthwhile character study into a grandstanding star vehicle.",The Blind Side,"['Comedy', 'Drama', 'Sports & Fitness']"
m/1212694-blind_side,"There are several good scenes, even if you can spot the Oscar / trailer clips a mile away, such as when one of Leigh Anne's stuck-up friends remarks ""You're changing that boy's life"" and she replies, ""Nope. He's changing mine.""",The Blind Side,"['Comedy', 'Drama', 'Sports & Fitness']"
m/1212694-blind_side,"The Blind Side wears its heart on its shoulder padding for the entire 128 minutes and eventually, the wholesomeness of the characters, pulling together for a common cause, wins us over.",The Blind Side,"['Comedy', 'Drama', 'Sports & Fitness']"
m/1212694-blind_side,Some will find it overly sentimental but it does succeed in pulling at the heartstrings - and Sandy proves she really can act.,The Blind Side,"['Comedy', 'Drama', 'Sports & Fitness']"
m/1212694-blind_side,"A Photoshopped image of reality that is bland, parochial, and stereotypically acted by a cast who have nothing like the subtlety and range of Trey Parker's puppets from Team America: World Police.",The Blind Side,"['Comedy', 'Drama', 'Sports & Fitness']"
m/1212694-blind_side,"Enjoyable, mass-market crowd pleaser that allowed Sandra Bullock to win an honorable Best Actress Oscar as the Republican spitfire who takes up the cause of a homeless teenager who just so happens to also be an outstanding left tackle.",The Blind Side,"['Comedy', 'Drama', 'Sports & Fitness']"
m/1212694-blind_side,"Zanatski korektno djelce u kojem poku%u0161aji da se filmu pred kraj ""napumpa"" drama nisu previ%u0161e uvjerljivi",The Blind Side,"['Comedy', 'Drama', 'Sports & Fitness']"
m/1212694-blind_side,It's guaranteed to make you feel all fuzzy and warm inside and the saintly Bullock makes up for the disastrous (and Razzie award-winning) All About Steve.,The Blind Side,"['Comedy', 'Drama', 'Sports & Fitness']"
m/1212694-blind_side,"Una cinta amena, sencilla de digerir y apta para toda la familia, una fbula de la vida real de las que pocas veces suceden y cuando lo hacen, son dignas de llevarlas a la pantalla.",The Blind Side,"['Comedy', 'Drama', 'Sports & Fitness']"
m/1212694-blind_side,Sports movie carefully sidesteps the issue of race and stereotypes,The Blind Side,"['Comedy', 'Drama', 'Sports & Fitness']"
m/1212694-blind_side,It often feels like a Republican curative for Precious.,The Blind Side,"['Comedy', 'Drama', 'Sports & Fitness']"
m/1212694-blind_side,"Although based in reality, John Lee Hancock's tale never seems more than just a more serious version of TV's Different Strokes or Webster.",The Blind Side,"['Comedy', 'Drama', 'Sports & Fitness']"
m/1212694-blind_side,The filmmakers are largely unable to dramatize Michael's personal development; throughout the film his internal life and thoughts remain a closed book.,The Blind Side,"['Comedy', 'Drama', 'Sports & Fitness']"
m/1212694-blind_side,"Generally enjoyable, but it isn't until the credits roll that you'll realize what a major sentimental impact it has on you.",The Blind Side,"['Comedy', 'Drama', 'Sports & Fitness']"
m/1212694-blind_side,"A nice-as-pie story that lacks any real tension or drama and threatens repeatedly to veer into sappy territory, yet somehow, just through foolhardy ""goodness"", manages to be consistently enjoyable (if a little slight) for its two hours.",The Blind Side,"['Comedy', 'Drama', 'Sports & Fitness']"
m/1212694-blind_side,"The Blind Side's heart is in the right place--how could it not be, it's got so much to go around--but that's about all that is. There's a good story in there, one that's probably worth experiencing, but load up on insulin before you go.",The Blind Side,"['Comedy', 'Drama', 'Sports & Fitness']"
m/1212694-blind_side,"While The Blind Side constantly threatens to deteriorate into sentimental saccharine, it never does. Bullock's accent grates at first, but she bonds well with McGraw",The Blind Side,"['Comedy', 'Drama', 'Sports & Fitness']"
m/1212694-blind_side,"Sing it together with me my brothers, thank the Lawd for he created the white man that he might teach them po' negroes the value of good Christian chariddy.",The Blind Side,"['Comedy', 'Drama', 'Sports & Fitness']"
m/1212694-blind_side,"The Blind Side, which has reportedly made close to 200 million dollars, is based on a true story (the operative word is ""based,"" of course).",The Blind Side,"['Comedy', 'Drama', 'Sports & Fitness']"
m/1212694-blind_side,You're going to be crying by the end.,The Blind Side,"['Comedy', 'Drama', 'Sports & Fitness']"
m/1212694-blind_side,"A living tribute to fundamental Christian motivations, although the point is hammered home with an extraordinarily soft touch: Love thy neighbor.",The Blind Side,"['Comedy', 'Drama', 'Sports & Fitness']"
m/1212694-blind_side,"Football may the thread that runs throughout, but the movie is much more interested in the tale of how Oher left behind a life of poverty, violence and foster-home despair to become a champ on the gridiron.",The Blind Side,"['Comedy', 'Drama', 'Sports & Fitness']"
m/1212694-blind_side,"Serves its purpose by making the audience tear up in some moments and cheer in others. It's a total button-pusher, but it does so in a very good way.",The Blind Side,"['Comedy', 'Drama', 'Sports & Fitness']"
m/1212694-blind_side,"It's certainly a heartwarming tale and Bullock delivers a big, ballsy performance as the indomitable Tuohy - but Oscar-worthy? What were they thinking?",The Blind Side,"['Comedy', 'Drama', 'Sports & Fitness']"
m/1212694-blind_side,"The movie is done with crispness, vigor, down-home humor, and an over-all tang of good feeling, but the pushing of buttons is the work of extraordinary calculation.",The Blind Side,"['Comedy', 'Drama', 'Sports & Fitness']"
m/1212694-blind_side,The movie is very familiar -- you've seen it all before -- but it succeeds at achieving its modest goals.,The Blind Side,"['Comedy', 'Drama', 'Sports & Fitness']"
m/1212694-blind_side,"As a fable about the power of giving, it hits pretty hard.",The Blind Side,"['Comedy', 'Drama', 'Sports & Fitness']"
m/1212694-blind_side,"[It] is all about the family's altruism and turns a blind eye to silent Michael, with father Sean offering up the excuse: ""Michael's gift is his ability to forget."" I'm not convinced but that didn't stop me from enjoying the film and admiring Bullock.",The Blind Side,"['Comedy', 'Drama', 'Sports & Fitness']"
m/1212694-blind_side,... I must say that I doubt I'd like the film as much had it not been Christmas and just a plain ole good family flick to see with my mom.,The Blind Side,"['Comedy', 'Drama', 'Sports & Fitness']"
m/1212694-blind_side,"This is a horrid film, and I hated it, and while, I suppose, you can't argue with a true story, you can always argue with the way it is told.",The Blind Side,"['Comedy', 'Drama', 'Sports & Fitness']"
m/1212694-blind_side,It felt tired and clichéd and the frequent and obvious emotional button-pushing failed to ignite any real response from me.,The Blind Side,"['Comedy', 'Drama', 'Sports & Fitness']"
m/1212694-blind_side,"Issues of race and racism are not left on the side, though, and the onscreen chemistry that [Sandra] Bullock and [Quinton] Aaron score is a game winner from the get-go.",The Blind Side,"['Comedy', 'Drama', 'Sports & Fitness']"
m/1212694-blind_side,The Blind Side is that rare formulaic flick that actually works.,The Blind Side,"['Comedy', 'Drama', 'Sports & Fitness']"
m/1213737-x_games_3d_the_movie,"Although the novelty of 3-D adds some drama to the contests, your snazzy glasses do nothing to block out the inanity that comes from the mouths of the participants, the play-by-play commentators, and narrator Emile Hirsch.",X Games 3D: The Movie,"['Documentary', 'Sports & Fitness']"
m/1213737-x_games_3d_the_movie,"A relatively unimaginative take on the proceedings, coupled with occasionally bizarre stereoscopic work and awkward narration, causes the pic to bail out more often than it soars.",X Games 3D: The Movie,"['Documentary', 'Sports & Fitness']"
m/1213737-x_games_3d_the_movie,3D adds a little something extra to this movie-length advertisement for X Games.,X Games 3D: The Movie,"['Documentary', 'Sports & Fitness']"
m/1213737-x_games_3d_the_movie,"As a movie, X-Games 3D: The Movie isn't a movie at all. It's a 90-minute commercial for the games, lacking much in the line of drama, compelling characters or story line.",X Games 3D: The Movie,"['Documentary', 'Sports & Fitness']"
m/1213737-x_games_3d_the_movie,"3D is X-treme film-making and thus well suited to the X Games, hyper-intense, hyper-dangerous, hyper-what are they thinking? sports that are closer to stunts.",X Games 3D: The Movie,"['Documentary', 'Sports & Fitness']"
m/1213737-x_games_3d_the_movie,"With its self-promoting tone and overwrought voice-over, the movie can seem more an ad for the X Games (and ESPN Films) than a real sports documentary.",X Games 3D: The Movie,"['Documentary', 'Sports & Fitness']"
m/1213737-x_games_3d_the_movie,"Narrated with overblown rhetoric by Emile Hirsch, Steve Lawrence's feature-length commercial only feigns interest in the backstories and motivations of its chosen subjects",X Games 3D: The Movie,"['Documentary', 'Sports & Fitness']"
m/1213737-x_games_3d_the_movie,"For fans of such activities, footage of their idols in action may be enough, but even they might find the movie overall surprisingly ordinary.",X Games 3D: The Movie,"['Documentary', 'Sports & Fitness']"
m/1213737-x_games_3d_the_movie,"What's in the film other than what you might have seen on TV? Yes, it's in 3D, which adds nothing and dims the picture.",X Games 3D: The Movie,"['Documentary', 'Sports & Fitness']"
m/1213737-x_games_3d_the_movie,"A deadly paced, sloppy parade of egos and stunts, Movie plays directly to the fanbase, who will be the only ones able to hurdle the slapdash nature of the direction and savor the airborne money shots.",X Games 3D: The Movie,"['Documentary', 'Sports & Fitness']"
m/1213737-x_games_3d_the_movie,"Wow, these guys are all totally driven and really want to win? You don't say.",X Games 3D: The Movie,"['Documentary', 'Sports & Fitness']"
m/1213737-x_games_3d_the_movie,"Aside from unrevealing sit-downs with a few key players, X-Games 3D: The Movie is mostly an overlong demo reel of increasingly gutsy tricks.",X Games 3D: The Movie,"['Documentary', 'Sports & Fitness']"
m/1213737-x_games_3d_the_movie,"Unfocused and underwhelming, X Games 3D is most notable as a missed opportunity.",X Games 3D: The Movie,"['Documentary', 'Sports & Fitness']"
m/1213737-x_games_3d_the_movie,"There's some jaw dropping eye candy in 'X Games 3D: The Movie,' but there are also wasted opportunities.",X Games 3D: The Movie,"['Documentary', 'Sports & Fitness']"
m/1213737-x_games_3d_the_movie,"This feature is X-treme only in its multidimensional dullness, which is compounded by interviews in which the interchangeable thrillbots discuss themselves and each other with an immense lack of insight.",X Games 3D: The Movie,"['Documentary', 'Sports & Fitness']"
m/1213737-x_games_3d_the_movie,"Has stunning 3D visuals which briefly provide a rush of adrenaline, but it often feels too dull while lacking insight and suspense as well as palpable excitement.",X Games 3D: The Movie,"['Documentary', 'Sports & Fitness']"
m/1213737-x_games_3d_the_movie,"Although the competitions are undoubtedly impressive achievements in the daredevil arts, as a record of what these mentally tough participants do, it too often feels like a warmed-over energy drink.",X Games 3D: The Movie,"['Documentary', 'Sports & Fitness']"
m/1213737-x_games_3d_the_movie,Sports documentary is full of sights -- and salesmanship.,X Games 3D: The Movie,"['Documentary', 'Sports & Fitness']"
m/1213737-x_games_3d_the_movie,"Those of us who prefer the winter edition of the X Games -- snowboarding and all that - would be happy to watch a counterpart film to this one, with a bit of snow. Just a hint, ESPN.",X Games 3D: The Movie,"['Documentary', 'Sports & Fitness']"
m/1213737-x_games_3d_the_movie,Be aware that the action is so extreme it verges on being a sports snuff film.,X Games 3D: The Movie,"['Documentary', 'Sports & Fitness']"
m/1213737-x_games_3d_the_movie,Parental Content Review,X Games 3D: The Movie,"['Documentary', 'Sports & Fitness']"
m/1213737-x_games_3d_the_movie,"Lawrence isn't asking us to consider these deeper thoughts. He's in it for the thrills, with no interest in the wives, children or friends who worry about the life these men have chosen.",X Games 3D: The Movie,"['Documentary', 'Sports & Fitness']"
m/1213737-x_games_3d_the_movie,"This promotion for the ESPN event is poorly written, contains too much hero worship and profiles too many events.",X Games 3D: The Movie,"['Documentary', 'Sports & Fitness']"
m/1213737-x_games_3d_the_movie,The highlight is a contest of wills between three contestants of the extreme skateboarding of the Slam event. It is heavy drama worth the price of the ticket.,X Games 3D: The Movie,"['Documentary', 'Sports & Fitness']"
m/1213737-x_games_3d_the_movie,"A dirt bike motorcycle enthusiast as well as a 3D aficionado, I had a great time overall, despite the film's imperfections.",X Games 3D: The Movie,"['Documentary', 'Sports & Fitness']"
m/1213737-x_games_3d_the_movie,"A slick, fawning, shamelessly commercial puff piece that occasionally hits on an eye-popping image and just goes sick.",X Games 3D: The Movie,"['Documentary', 'Sports & Fitness']"
m/1213737-x_games_3d_the_movie,"Such dime-store philosophy, coupled with the running commentary from the Games' heinously Spicoli-esque announcers, ruins an otherwise gripping, in-your-face experience.",X Games 3D: The Movie,"['Documentary', 'Sports & Fitness']"
m/1213737-x_games_3d_the_movie,"You might enjoy this oddball ESPN documentary about extreme sports including skateboarding, motorcycling and motocross. Mostly, I think, it's aimed at kids and/or extreme sports enthusiasts.",X Games 3D: The Movie,"['Documentary', 'Sports & Fitness']"
m/1216015-horse_boy,A heartfelt tale of a family that traveled to Outer Mongolia to exorcise their four-year-old's autistic dybbuk.,The Horse Boy,"['Documentary', 'Special Interest', 'Sports & Fitness']"
m/1216015-horse_boy,"The healing odyssey, directed by Michel Orion Scott, provides a powerful look at the complex condition of autism and family dedication.",The Horse Boy,"['Documentary', 'Special Interest', 'Sports & Fitness']"
m/1216015-horse_boy,The Horse Boy isn't trying to provide any definitive answers about autism. It's offering intriguing possibilities.,The Horse Boy,"['Documentary', 'Special Interest', 'Sports & Fitness']"
m/1216015-horse_boy,"It's seldom that a film captures something as fragile as a transformation of the human soul, but this documentary of a family's journey to help their autistic child accomplishes just that.",The Horse Boy,"['Documentary', 'Special Interest', 'Sports & Fitness']"
m/1216015-horse_boy,A deeply intimate and endlessly inspiring look at a condition the general public knows only at a remove.,The Horse Boy,"['Documentary', 'Special Interest', 'Sports & Fitness']"
m/1216015-horse_boy,"Inspiring, enlightening and affirmative journey into the mysteries of shamanism and autism.",The Horse Boy,"['Documentary', 'Special Interest', 'Sports & Fitness']"
m/1216015-horse_boy,Provocative and moving documentary focuses on parents of an autistic boy who take a radical course of action.,The Horse Boy,"['Documentary', 'Special Interest', 'Sports & Fitness']"
m/1216015-horse_boy,"Some people's stories are so interesting that a book or a movie adaptation alone simply won't suffice. Sometimes both are needed. Apparently, Rupert Isaacson's is one of them.",The Horse Boy,"['Documentary', 'Special Interest', 'Sports & Fitness']"
m/1216015-horse_boy,"A quest toward an inevitable inspirational destination, continuing the recent trend of using precious theater space as dumping grounds for a-cinematic PBS also-rans.",The Horse Boy,"['Documentary', 'Special Interest', 'Sports & Fitness']"
m/1216015-horse_boy,"A well-edited, profoundly engrossing, inspirational and thoroughly captivating documentary.",The Horse Boy,"['Documentary', 'Special Interest', 'Sports & Fitness']"
m/1216015-horse_boy,"It recounts a deeply personal, highly subjective and inarguably thought-provoking story of one family's quest for a certain kind of peace.",The Horse Boy,"['Documentary', 'Special Interest', 'Sports & Fitness']"
m/1216015-horse_boy,A lyrical and stirring meditation on the mystery of autism.,The Horse Boy,"['Documentary', 'Special Interest', 'Sports & Fitness']"
m/1216015-horse_boy,A fascinating examination of parental love and the blind faith that sometimes is required in what otherwise seems like a cold and cruel world.,The Horse Boy,"['Documentary', 'Special Interest', 'Sports & Fitness']"
m/1216015-horse_boy,The strength of the doc is that is does not propagandize with a heavy hand.,The Horse Boy,"['Documentary', 'Special Interest', 'Sports & Fitness']"
m/1216015-horse_boy,"By failing to break new ground in the non-fiction genre, Scott misses out on all the dramatic potential Horse Boy has to offer.",The Horse Boy,"['Documentary', 'Special Interest', 'Sports & Fitness']"
m/1216015-horse_boy,"An extraordinary journey of the heart and spirit, and a stirring testament to parenthood.",The Horse Boy,"['Documentary', 'Special Interest', 'Sports & Fitness']"
m/1216015-horse_boy,"The Horse Boy is a lovely, amazing, wonderfully provocative film.",The Horse Boy,"['Documentary', 'Special Interest', 'Sports & Fitness']"
m/1216015-horse_boy,"Horse Boy is a valuable, stirring motion picture. It's a poignant step to understanding the mysteries of the mind and a critical, exquisite reminder of unconditional parental love.",The Horse Boy,"['Documentary', 'Special Interest', 'Sports & Fitness']"
m/1216015-horse_boy,"The Horse Boy is a nicely photographed real-life adventure, and with some wisdom about autism for everyone along the pathway.",The Horse Boy,"['Documentary', 'Special Interest', 'Sports & Fitness']"
m/1216015-horse_boy,"In the footage taken after the healing, we never see Rowan, except when he is happily playing with his new friends or smiling with his parents. Is that the whole story? You decide.",The Horse Boy,"['Documentary', 'Special Interest', 'Sports & Fitness']"
m/1216015-horse_boy,What it might contribute to the topic of autism and change -- over and above the mysterious (but documented) healing power of hanging around horses -- appears to be hope.,The Horse Boy,"['Documentary', 'Special Interest', 'Sports & Fitness']"
m/1216015-horse_boy,The film's particular story serves as a powerful reminder to all parents that a child's unique strengths and personality may suggest the best path toward healing.,The Horse Boy,"['Documentary', 'Special Interest', 'Sports & Fitness']"
m/1216015-horse_boy,The Horse Boy succeeds both as a provocative inquiry into the mysteries of autism and as a true-life adventure tale.,The Horse Boy,"['Documentary', 'Special Interest', 'Sports & Fitness']"
m/1216015-horse_boy,It moved me right at my core and made me continually think of the world around us and how we treat it. Rowan's saga hits home soaring to heights so many narrative features can only dream of achieving.,The Horse Boy,"['Documentary', 'Special Interest', 'Sports & Fitness']"
m/1216015-horse_boy,It's because the premise is so intriguing and the drama is so compelling that the result is so confounding.,The Horse Boy,"['Documentary', 'Special Interest', 'Sports & Fitness']"
m/1216015-horse_boy,True-to-life stories about the personal growth of attractive white people are all the cinematic rage these days ... and at its worst The Horse Boy seems both an invasion of privacy...and a cold-hearted attempt to cash in on a trendy topic.,The Horse Boy,"['Documentary', 'Special Interest', 'Sports & Fitness']"
m/1216015-horse_boy,The story it tells is little short of incredible.,The Horse Boy,"['Documentary', 'Special Interest', 'Sports & Fitness']"
m/1216015-horse_boy,"A sensitive and compelling portrait of the lengths one family is willing to go -- specifically, to the wilds of Mongolia -- to reach their autistic child.",The Horse Boy,"['Documentary', 'Special Interest', 'Sports & Fitness']"
m/1216015-horse_boy,"May not break any new ground in the documentary department, but it's a mildly successful middle of the road effort",The Horse Boy,"['Documentary', 'Special Interest', 'Sports & Fitness']"
m/1216015-horse_boy,To force us to endure the Mongolian sojourn feels more like a trip of the ego than any other grand journey.,The Horse Boy,"['Documentary', 'Special Interest', 'Sports & Fitness']"
