rotten_tomatoes_link,review_content,movie_title,genre_list
m/because_of_winndixie,A whimsical family film about longing and belonging told with gentle humanity.,Because of Winn-Dixie,"['Comedy', 'Drama', 'Kids & Family', 'Sports & Fitness']"
m/because_of_winndixie,"This simple coming-of-age tale tends to drift away on tangential story lines, but should still warm the hearts of audiences of all ages.",Because of Winn-Dixie,"['Comedy', 'Drama', 'Kids & Family', 'Sports & Fitness']"
m/because_of_winndixie,This is a so-so story that's told incorrectly.,Because of Winn-Dixie,"['Comedy', 'Drama', 'Kids & Family', 'Sports & Fitness']"
m/because_of_winndixie,"Because of Winn-Dixie meets cute, but in the end it grates on the nerves.",Because of Winn-Dixie,"['Comedy', 'Drama', 'Kids & Family', 'Sports & Fitness']"
m/because_of_winndixie,[The movie] manages to eradicate any meaningful subtleties that are present in Kate DiCamillo's 2001 Newberry Award-winning children's book.,Because of Winn-Dixie,"['Comedy', 'Drama', 'Kids & Family', 'Sports & Fitness']"
m/because_of_winndixie,Winn-Dixie has a way of growing on you.,Because of Winn-Dixie,"['Comedy', 'Drama', 'Kids & Family', 'Sports & Fitness']"
m/because_of_winndixie,"As family films go, Winn-Dixie is only mildly successful and a bit bland.",Because of Winn-Dixie,"['Comedy', 'Drama', 'Kids & Family', 'Sports & Fitness']"
m/because_of_winndixie,A refreshingly old-fashioned family movie that doesn't rely on smart-alecky humor or pop culture references to keep kids in their seats.,Because of Winn-Dixie,"['Comedy', 'Drama', 'Kids & Family', 'Sports & Fitness']"
m/because_of_winndixie,"Because of Winn Dixie is a touching, sincere, heart-warming family film that nonetheless made me want to bail after about 30 minutes.",Because of Winn-Dixie,"['Comedy', 'Drama', 'Kids & Family', 'Sports & Fitness']"
m/because_of_winndixie,Because is proof positive that nostalgia and dogs go together like Winn and Dixie.,Because of Winn-Dixie,"['Comedy', 'Drama', 'Kids & Family', 'Sports & Fitness']"
m/because_of_winndixie,"It's not that the film is a family classic; far from it. But the simple, heartwarming story of a girl and her dog, based on the popular book by Kate DiCamillo, should satisfy its 8- to 12-year-old target demographic.",Because of Winn-Dixie,"['Comedy', 'Drama', 'Kids & Family', 'Sports & Fitness']"
m/because_of_winndixie,"Winn-Dixie has everything but the drama, and while that doesn't make it a dog, it never raises it above the status of stuffed toy.",Because of Winn-Dixie,"['Comedy', 'Drama', 'Kids & Family', 'Sports & Fitness']"
m/because_of_winndixie,Mildly diverting and way too long for a movie aimed at kids.,Because of Winn-Dixie,"['Comedy', 'Drama', 'Kids & Family', 'Sports & Fitness']"
m/because_of_winndixie,"Has some wan jokes, incongruous slapstick and the occasional embarrassment, which may keep it from being as popular as the Newberry Award-winning novel by Kate DiCamillo.",Because of Winn-Dixie,"['Comedy', 'Drama', 'Kids & Family', 'Sports & Fitness']"
m/because_of_winndixie,The best of this year's family-friendly film explosion so far.,Because of Winn-Dixie,"['Comedy', 'Drama', 'Kids & Family', 'Sports & Fitness']"
m/because_of_winndixie,"A dreary, uninspired tale.",Because of Winn-Dixie,"['Comedy', 'Drama', 'Kids & Family', 'Sports & Fitness']"
m/because_of_winndixie,Won't disappoint any elementary school kid or the moms and dads who treasure their dog-eared copies of Kate DiCamillo's Newbery-honored children's novel.,Because of Winn-Dixie,"['Comedy', 'Drama', 'Kids & Family', 'Sports & Fitness']"
m/because_of_winndixie,Inoffensive fodder for the family trade.,Because of Winn-Dixie,"['Comedy', 'Drama', 'Kids & Family', 'Sports & Fitness']"
m/because_of_winndixie,A thoughtful and sometimes poignant study of how a 10-year-old girl copes with loneliness.,Because of Winn-Dixie,"['Comedy', 'Drama', 'Kids & Family', 'Sports & Fitness']"
m/because_of_winndixie,This charming coming-of-age kiddie movie delivers the good.,Because of Winn-Dixie,"['Comedy', 'Drama', 'Kids & Family', 'Sports & Fitness']"
m/because_of_winndixie,This is a movie to take your kids to.,Because of Winn-Dixie,"['Comedy', 'Drama', 'Kids & Family', 'Sports & Fitness']"
m/because_of_winndixie,Parents who claim they crave thoughtful entertainment for their kids finally have a movie they can get behind.,Because of Winn-Dixie,"['Comedy', 'Drama', 'Kids & Family', 'Sports & Fitness']"
m/because_of_winndixie,"Because of Winn-Dixie doesn't have a mean bone in its body, but it's dead in the water.",Because of Winn-Dixie,"['Comedy', 'Drama', 'Kids & Family', 'Sports & Fitness']"
m/because_of_winndixie,Manages to overcome the sense of its being overly familiar.,Because of Winn-Dixie,"['Comedy', 'Drama', 'Kids & Family', 'Sports & Fitness']"
m/because_of_winndixie,Doesn't exactly rise to the level of a family classic.,Because of Winn-Dixie,"['Comedy', 'Drama', 'Kids & Family', 'Sports & Fitness']"
m/because_of_winndixie,"It makes a fine argument for what kid-friendly, Christian-compassionate entertainment can be.",Because of Winn-Dixie,"['Comedy', 'Drama', 'Kids & Family', 'Sports & Fitness']"
m/because_of_winndixie,A wonderful smiling sheepdog steals this heartwarming movie from its human actors.,Because of Winn-Dixie,"['Comedy', 'Drama', 'Kids & Family', 'Sports & Fitness']"
m/because_of_winndixie,It's so much more honest than the average Hollywood blather that I think you'll end up in my camp.,Because of Winn-Dixie,"['Comedy', 'Drama', 'Kids & Family', 'Sports & Fitness']"
m/because_of_winndixie,"Without becoming particularly preachy or heavy-handed, 'Winn-Dixie' insists that acceptance and tolerance are integral parts of Christianity.",Because of Winn-Dixie,"['Comedy', 'Drama', 'Kids & Family', 'Sports & Fitness']"
m/because_of_winndixie,The unconditional love of a great dog can work miracles in anyone's life. Kids will love the dog and forget all the parts that don't work for them.,Because of Winn-Dixie,"['Comedy', 'Drama', 'Kids & Family', 'Sports & Fitness']"
m/because_of_winndixie,[The script] can never decide whether this is supposed to be an over-the-top comedy or a deeply moving drama -- and doesn't do that well at either.,Because of Winn-Dixie,"['Comedy', 'Drama', 'Kids & Family', 'Sports & Fitness']"
m/because_of_winndixie,"In pace, sensibility, and big, beating heart, this is a child's first indie film, and it's the better for it.",Because of Winn-Dixie,"['Comedy', 'Drama', 'Kids & Family', 'Sports & Fitness']"
m/because_of_winndixie,"Most of the time, you can't go wrong with kids and dogs. Then there's Because of Winn-Dixie.",Because of Winn-Dixie,"['Comedy', 'Drama', 'Kids & Family', 'Sports & Fitness']"
m/because_of_winndixie,"Sure, there's nothing here that hasn't already been covered in a Hallmark movie, but it's still refreshing to find a well-made, enjoyable film for families.",Because of Winn-Dixie,"['Comedy', 'Drama', 'Kids & Family', 'Sports & Fitness']"
m/because_of_winndixie,"There's bad, there's ""so bad it's good""... and then there's this moronic film.",Because of Winn-Dixie,"['Comedy', 'Drama', 'Kids & Family', 'Sports & Fitness']"
m/because_of_winndixie,Because of Winn-Dixie-based on the beloved novel by Kate DiCamillo-turns out to be a modest success for the family crowd.,Because of Winn-Dixie,"['Comedy', 'Drama', 'Kids & Family', 'Sports & Fitness']"
m/because_of_winndixie,[S]mart and sweet but unsentimental and warmly genuine in its portrait of childhood innocence and the adventure of growing up...,Because of Winn-Dixie,"['Comedy', 'Drama', 'Kids & Family', 'Sports & Fitness']"
m/because_of_winndixie,I wanted to like Winn-Dixie ... I just didn't believe it.,Because of Winn-Dixie,"['Comedy', 'Drama', 'Kids & Family', 'Sports & Fitness']"
m/because_of_winndixie,An unhomogenized combination of formulaic family entertainment and cornpone Southern fable.,Because of Winn-Dixie,"['Comedy', 'Drama', 'Kids & Family', 'Sports & Fitness']"
m/because_of_winndixie,"Because of Winn-Dixie, based on the much-praised children's book by Kate DiCamillo, is about loss and the ways people deal with it, but also about joy, hope and love.",Because of Winn-Dixie,"['Comedy', 'Drama', 'Kids & Family', 'Sports & Fitness']"
m/because_of_winndixie,"Nothing more than a series of scenes, first cute, then sentimental, then funny, and then the cycle repeats itself.",Because of Winn-Dixie,"['Comedy', 'Drama', 'Kids & Family', 'Sports & Fitness']"
m/because_of_winndixie,The moment is so identical to a pivotal scene in Lars von Trier's Dogville that it makes one wonder if director Wayne Wang is intentionally paying homage.,Because of Winn-Dixie,"['Comedy', 'Drama', 'Kids & Family', 'Sports & Fitness']"
m/because_of_winndixie,Because of Winn-Dixie should provide a pleasant family outing free of any cinematic mange.,Because of Winn-Dixie,"['Comedy', 'Drama', 'Kids & Family', 'Sports & Fitness']"
m/because_of_winndixie,"Director Damien O'Donnell crafts this well-acted, funny, moving story that speaks to people's loneliness and the need to connect. This film is great for kids and adults alike.",Because of Winn-Dixie,"['Comedy', 'Drama', 'Kids & Family', 'Sports & Fitness']"
m/because_of_winndixie,An innocuous and sleepy-eyed kiddie fable that resonates occasionally in its tenderness. Intermittently dour and drab in some instances [but] also very charming and observant,Because of Winn-Dixie,"['Comedy', 'Drama', 'Kids & Family', 'Sports & Fitness']"
m/because_of_winndixie,"The ideal candidate for a summer release, not a February schlep-off.",Because of Winn-Dixie,"['Comedy', 'Drama', 'Kids & Family', 'Sports & Fitness']"
m/because_of_winndixie,A spiritually uplifting old-fashioned shaggy-dog tale that is without guile.,Because of Winn-Dixie,"['Comedy', 'Drama', 'Kids & Family', 'Sports & Fitness']"
m/because_of_winndixie,A sweet movie that takes its own sweet time in telling its story.,Because of Winn-Dixie,"['Comedy', 'Drama', 'Kids & Family', 'Sports & Fitness']"
m/because_of_winndixie,"Some older viewers might be confused that director Wayne Wang offers no entry point for grownups. This is a kid's view of the world, free of irony and in-jokes.",Because of Winn-Dixie,"['Comedy', 'Drama', 'Kids & Family', 'Sports & Fitness']"
m/because_of_winndixie,"For every scene where the shaggy dog gives a human-looking smile, there's another about the unavoidable sadness that comes with walking on two legs rather than four.",Because of Winn-Dixie,"['Comedy', 'Drama', 'Kids & Family', 'Sports & Fitness']"
m/because_of_winndixie,...wait til it hits cable...that goes for you too Dave Matthews fans.,Because of Winn-Dixie,"['Comedy', 'Drama', 'Kids & Family', 'Sports & Fitness']"
m/because_of_winndixie,"Heart-warming, old-fashioned family fare",Because of Winn-Dixie,"['Comedy', 'Drama', 'Kids & Family', 'Sports & Fitness']"
m/because_of_winndixie,[T]his sweet-tempered adaptation is a film that parents and kids can enjoy together.,Because of Winn-Dixie,"['Comedy', 'Drama', 'Kids & Family', 'Sports & Fitness']"
m/because_of_winndixie,Plenty entertaining and chock full of valuable lessons about friendship and respect.,Because of Winn-Dixie,"['Comedy', 'Drama', 'Kids & Family', 'Sports & Fitness']"
m/because_of_winndixie,If they let the dog go I think we'd have a better movie.,Because of Winn-Dixie,"['Comedy', 'Drama', 'Kids & Family', 'Sports & Fitness']"
m/because_of_winndixie,"It's heavy on metaphor and voiceover, and weak on passion...",Because of Winn-Dixie,"['Comedy', 'Drama', 'Kids & Family', 'Sports & Fitness']"
m/because_of_winndixie,"Like a big glass of milk and a slice of apple pie, Because of Winn-Dixie is just as wholesome as it gets, if you don't mind overdosing on the sugar once in awhile.",Because of Winn-Dixie,"['Comedy', 'Drama', 'Kids & Family', 'Sports & Fitness']"
m/because_of_winndixie,Despite its charm the material is simply too thin for 106 minutes of screen time.,Because of Winn-Dixie,"['Comedy', 'Drama', 'Kids & Family', 'Sports & Fitness']"
m/because_of_winndixie,"Starting with the dog, Wang's warm-and-fuzzy story could have used some careful trimming.",Because of Winn-Dixie,"['Comedy', 'Drama', 'Kids & Family', 'Sports & Fitness']"
m/because_of_winndixie,[It's] a delightfully moving experience... It's more than a good kids' movie; it's a good movie for everyone.,Because of Winn-Dixie,"['Comedy', 'Drama', 'Kids & Family', 'Sports & Fitness']"
m/because_of_winndixie,"About 110 minutes of well-meaning, benign unoriginality",Because of Winn-Dixie,"['Comedy', 'Drama', 'Kids & Family', 'Sports & Fitness']"
m/because_of_winndixie,Because of Winn-Dixie's heart-tugging sadness makes its joy even sweeter.,Because of Winn-Dixie,"['Comedy', 'Drama', 'Kids & Family', 'Sports & Fitness']"
m/because_of_winndixie,"It's all very sweet, the acting is excellent, especially Tyson and young Ms. Robb. The dog is very good too.",Because of Winn-Dixie,"['Comedy', 'Drama', 'Kids & Family', 'Sports & Fitness']"
m/because_of_winndixie,I left the theater with joy in my heart. And it's all because of Winn-Dixie.,Because of Winn-Dixie,"['Comedy', 'Drama', 'Kids & Family', 'Sports & Fitness']"
m/because_of_winndixie,One of the bright spots in last few weeks.,Because of Winn-Dixie,"['Comedy', 'Drama', 'Kids & Family', 'Sports & Fitness']"
m/because_of_winndixie,The movie offers a loving but strikingly tempered assessment of family and town life that one seldom finds in today's raucous family films.,Because of Winn-Dixie,"['Comedy', 'Drama', 'Kids & Family', 'Sports & Fitness']"
m/because_of_winndixie,"not heavy on plot, but it is a series of charming adventures with common, heart warming themes about finding friendship and dealing with hardship",Because of Winn-Dixie,"['Comedy', 'Drama', 'Kids & Family', 'Sports & Fitness']"
m/because_of_winndixie,"A cloying 'family entertainment' filled to the bubbling brim with goody-goody intentions and, somehow, managing to deliver on none of them.",Because of Winn-Dixie,"['Comedy', 'Drama', 'Kids & Family', 'Sports & Fitness']"
m/because_of_winndixie,The untidy answers and selfless actions in Because of Winn-Dixie stand out from the family films populated with bratty kids and clueless adults.,Because of Winn-Dixie,"['Comedy', 'Drama', 'Kids & Family', 'Sports & Fitness']"
m/because_of_winndixie,A children's film that embraces storytelling modesty and a balanced view of the world as both depressing and joyous.,Because of Winn-Dixie,"['Comedy', 'Drama', 'Kids & Family', 'Sports & Fitness']"
m/because_of_winndixie,"Relentlessly cute and adorable, it at least has a slight sour edge that gives us above-8s something to cling to. Briefly.",Because of Winn-Dixie,"['Comedy', 'Drama', 'Kids & Family', 'Sports & Fitness']"
m/because_of_winndixie,"Because of Winn-Dixie does no harm, and it should appeal to younger children while charming more than a few adults.",Because of Winn-Dixie,"['Comedy', 'Drama', 'Kids & Family', 'Sports & Fitness']"
m/because_of_winndixie,"Just the latest quasi-magic-realist, two-birds-with-one-stone shrine to non-traditional families and the power of myth",Because of Winn-Dixie,"['Comedy', 'Drama', 'Kids & Family', 'Sports & Fitness']"
m/because_of_winndixie,"A sweet film, laced with magic realism, and it tackles some rather dark themes in a way that is perfectly appropriate for young children.",Because of Winn-Dixie,"['Comedy', 'Drama', 'Kids & Family', 'Sports & Fitness']"
m/because_of_winndixie,A girl and a dog educate a small southern town.,Because of Winn-Dixie,"['Comedy', 'Drama', 'Kids & Family', 'Sports & Fitness']"
m/because_of_winndixie,"Thoughtful, personal drama, complex and with much to say.",Because of Winn-Dixie,"['Comedy', 'Drama', 'Kids & Family', 'Sports & Fitness']"
m/because_of_winndixie,It's a simple film and a simple story.,Because of Winn-Dixie,"['Comedy', 'Drama', 'Kids & Family', 'Sports & Fitness']"
m/beerfest,"This ode to the mass consumption of tasty brews is out of bubbles. Drink up before you see it, you'll need the buzz.",Beerfest,"['Comedy', 'Sports & Fitness']"
m/beerfest,"Beerfest unfolds like a decent college kegger, the best moments coming late in the carousal, as more suds are quaffed, inhibitions loosen up and everything starts seeming funnier.",Beerfest,"['Comedy', 'Sports & Fitness']"
m/beerfest,"You'll find yourself shaking your head, then laughing your @$$ off at the next bad joke.",Beerfest,"['Comedy', 'Sports & Fitness']"
m/beerfest,"Both filthier and funnier than Broken Lizard's prior efforts, Beerfest is still decidedly hit-or-miss.",Beerfest,"['Comedy', 'Sports & Fitness']"
m/beerfest,"These guys look like a bunch of accountants making movies on their smoke break, and Beerfest isn't made to please anybody but their fraternity brothers still chained to their Peter Pan Syndrome.",Beerfest,"['Comedy', 'Sports & Fitness']"
m/beerfest,"I can't remember a year when there have been as many horrible movies. ""Beerfest"" is the poster child for them...makes ""Talladega Nights"" look like Hamlet.",Beerfest,"['Comedy', 'Sports & Fitness']"
m/beerfest,"A hard 'R' comedy outfitted with plenty of female nudity and no unnecessary romantic subplots, Beer Fest has all the commitment of a night of drunken college debauchery and none of the ""double secret probation"" ramifications.",Beerfest,"['Comedy', 'Sports & Fitness']"
m/beerfest,Any filmgoer off the street could head into this one dry and still find something hard to laugh at.,Beerfest,"['Comedy', 'Sports & Fitness']"
m/beerfest,"... guys in lederhosen and Tyrolean hats with mincing mock-German accents, American can-do spirit in the face of overwhelming beer consumption, and gratuitous sight gags.",Beerfest,"['Comedy', 'Sports & Fitness']"
m/beerfest,"funny when it goes for outrageous and farcical, but tedious when it displays the originality of a Kevin Federline rap.",Beerfest,"['Comedy', 'Sports & Fitness']"
m/beerfest,The boys of Broken Lizard have no shame. That's what their fans like about them.,Beerfest,"['Comedy', 'Sports & Fitness']"
m/beerfest,"Juvenile, scattershot, eager-to-please, and laugh-out-loud funny.",Beerfest,"['Comedy', 'Sports & Fitness']"
m/beerfest,Accept Beer Fest for the ludicrous frat-boy fantasyland it strives to portray and there's a chance you might laugh at most of it. There's a better chance that you'll hate yourself for it the next morning.,Beerfest,"['Comedy', 'Sports & Fitness']"
m/beerfest,"The Broken Lizard comedy troupe returns to the big screen with a film that is, impossibly, even more sophomoric than their seminal Super Troopers.",Beerfest,"['Comedy', 'Sports & Fitness']"
m/beerfest,"Silly, very un-PC, often laugh-out-loud funny and refreshingly short on bathroom humor, Beerfest is Strange Brew's endearingly ungainly cousin.",Beerfest,"['Comedy', 'Sports & Fitness']"
m/beerfest,Knows it's a dumb movie and plugs ahead cheerily and without pretention...but the jokes quickly run thin.,Beerfest,"['Comedy', 'Sports & Fitness']"
m/beerfest,Beerfest serves up a keg's worth of fun.,Beerfest,"['Comedy', 'Sports & Fitness']"
m/beerfest,"Beerfest is one sloppy comedy, but the lads of the comedy troupe Broken Lizard don't know when to say when in their pursuit of the idiotic laugh.",Beerfest,"['Comedy', 'Sports & Fitness']"
m/beerfest,There's roughly a pint of quality comedy rattling around in this keg-sized movie.,Beerfest,"['Comedy', 'Sports & Fitness']"
m/beerfest,An hour and 50 minutes! Were they trying for the War and Peace of chugger flicks?,Beerfest,"['Comedy', 'Sports & Fitness']"
m/beerfest,Beerfest has a good time making fun of two genres: Mighty Ducks/team-of-plucky-misfits movies and Magnificent Seven/assemble-a-crack-team-of-experts movies.,Beerfest,"['Comedy', 'Sports & Fitness']"
m/beerfest,Beerfest might not be your cup of tea -- or mug of pilsener -- but fans of the group's earlier movies (Super Troopers and Club Dread) know what to expect: cleverly construed bad taste.,Beerfest,"['Comedy', 'Sports & Fitness']"
m/beerfest,"At 111 minutes, the movie is too slackly paced to build up enough momentum; like the characters they play, these guys don't know when to call it a night.",Beerfest,"['Comedy', 'Sports & Fitness']"
m/beerfest,"If you're not amused by German accents or burping, this probably isn't your movie.",Beerfest,"['Comedy', 'Sports & Fitness']"
m/beerfest,The middle of the movie is plenty long and aimless enough for the troupe to cobble together a handful of quality gags.,Beerfest,"['Comedy', 'Sports & Fitness']"
m/beerfest,"Like just about every other American screen comedy of the moment, it's far too long in the tooth, with a scattershot final half-hour that seems the work of an editor battling a bad hangover.",Beerfest,"['Comedy', 'Sports & Fitness']"
m/beerfest,You'd have to be drunk to appreciate Beerfest. Really drunk. So sloshed that you don't know which way is up or down. So wasted that the dull and overlong seems witty and sharp.,Beerfest,"['Comedy', 'Sports & Fitness']"
m/beerfest,Would easily qualify as the most aggressively stupid movie of the year had it not been trumped by a movie about NASCAR.,Beerfest,"['Comedy', 'Sports & Fitness']"
m/beerfest,"... there is a lot of dead air, most of which is filled with bare breasts and loud burps.",Beerfest,"['Comedy', 'Sports & Fitness']"
m/beerfest,"Nothing to celebrate...a loud, boozy bust.",Beerfest,"['Comedy', 'Sports & Fitness']"
m/beerfest,peeing jokes peaked with Leslie Nielsen's marathon whiz in The Naked Gun,Beerfest,"['Comedy', 'Sports & Fitness']"
m/beerfest,The tone of Beerfest is like South Park if they did an episode only about the adults in South Park... Even real German actors put on ridiculous accents.,Beerfest,"['Comedy', 'Sports & Fitness']"
m/beerfest,"I felt oddly respected: Neck-deep in barley and boobs, marinated in urine, Beerfest panders shamelessly to the 15-year-old in this 30-year-old... without assuming he is a 15-year-old.",Beerfest,"['Comedy', 'Sports & Fitness']"
m/beerfest,My best suggestion for people who insist on going to see this immense waste of time? Go drunk.,Beerfest,"['Comedy', 'Sports & Fitness']"
m/beerfest,"Ok, so maybe you don't absolutely have to have a Y chromosome and be 14 years old (or have the mind of a 14-year-old) to appreciate the freshmanic humor that is Beerfest. But, oh, does it help.",Beerfest,"['Comedy', 'Sports & Fitness']"
m/beerfest,"Beerfest plays like a party that's gone on too long, when the buzz has worn off and the hangover starts to set in.",Beerfest,"['Comedy', 'Sports & Fitness']"
m/beerfest,The Broken Lizard comedy troupe's fourth feature is funnier than you might imagine.,Beerfest,"['Comedy', 'Sports & Fitness']"
m/beerfest,"A movie that feels as if it was conceived, executed, edited and ultimately released by people in an advanced state of gassy inebriation.",Beerfest,"['Comedy', 'Sports & Fitness']"
m/beerfest,"Beerfest is an excuse to get happily dumb and decadent, which would be great if the movie was actually funny.",Beerfest,"['Comedy', 'Sports & Fitness']"
m/beerfest,"Fans of Broken Lizard will appreciate the obnoxiousness, but all the audacity is less ""transgressive"" of social norms than conventional.",Beerfest,"['Comedy', 'Sports & Fitness']"
m/beerfest,"If you like to drink Pabst Blue Ribbon beer, you'll probably like this movie. If you're a cognac person, the scene where the great-grandmother performs a sex act on a sausage may not be refined enough for your tastes.",Beerfest,"['Comedy', 'Sports & Fitness']"
m/beerfest,"Because it's basically sketch comedy, it suffers from that unevenness that comes from trying to string a bunch of sketches together to form a cohesive whole. It is also ribald, outrageous, shameless, and oddly warmhearted.",Beerfest,"['Comedy', 'Sports & Fitness']"
m/beerfest,"It's fun-dumb and definitely not everyone's cup of tea -- I don't want to oversell it -- but Broken Lizard keeps it interesting by refusing to color inside the lines, creating their own silly little universe.",Beerfest,"['Comedy', 'Sports & Fitness']"
m/beerfest,"It's amusing on occasion, but also garbled, repetitious and potentially offensive.",Beerfest,"['Comedy', 'Sports & Fitness']"
m/beerfest,This movie will be as essential to the DKE house as a Sharpie for writing jokes on a passed-out brother; it's pure guy humor.,Beerfest,"['Comedy', 'Sports & Fitness']"
m/beerfest,"Among the cast, Chandrasekhar is easily the funniest of the Lizards, though in fairness, each has his moments. The movie does, too; just expect them to shrink exponentially depending on your level of sobriety.",Beerfest,"['Comedy', 'Sports & Fitness']"
m/beerfest,"Still, while Beerfest is chaotic and lame, the truth is, it never pretends to be anything else.",Beerfest,"['Comedy', 'Sports & Fitness']"
m/beerfest,"Thanks to Broken Lizard, beer drinkers finally have a movie to call their own%u2026 and it kicks ***.",Beerfest,"['Comedy', 'Sports & Fitness']"
m/beerfest,"Beerfest features more beer consumed on screen than any movie since Strange Brew, while simultaneously offering less in the way of redeeming social value than Freddy Got Fingered.",Beerfest,"['Comedy', 'Sports & Fitness']"
m/beerfest,"Good for a few giggles, some of that stuff. But you'll probably have more laughs over a couple cold ones at the neighborhood bar than you will at Beerfest.",Beerfest,"['Comedy', 'Sports & Fitness']"
m/beerfest,"Ultimately, the film's target demographic is the same people that engage in these drinking games and incessantly quote Old School. To them, it is a classic on a par with The Wedding Crashers. All others should opt out for a cold one.",Beerfest,"['Comedy', 'Sports & Fitness']"
m/beerfest,"Broken Lizard fans might enjoy this idiocy, but there isn't enough here to attract any new audiences for the troupe's silly antics.",Beerfest,"['Comedy', 'Sports & Fitness']"
