rotten_tomatoes_link,review_content,movie_title,genre_list
m/1155467-glory_road,"Exacerbates difficult issues by blowing them into underdog sports cliches and, more damning, race caricatures and slapstick, sitcom misunderstandings and pat rapprochements.",Glory Road,"['Drama', 'Sports & Fitness']"
m/1155467-glory_road,"By knocking the edges off Glory Road, Bruckheimer has turned a raw, compelling story into bland pudding.",Glory Road,"['Drama', 'Sports & Fitness']"
m/1155467-glory_road,"The performers serve the story, acting with humility and respect, never going for the glamour or the drama.",Glory Road,"['Drama', 'Sports & Fitness']"
m/1155467-glory_road,"When coach Don Haskins sent out five African-American starters to face off against an all-white Wildcat team, barriers were broken, but Glory Road just hits the wall.",Glory Road,"['Drama', 'Sports & Fitness']"
m/1155467-glory_road,"The air of deja vu is thick as molasses in Glory Road, a lively but overly slick and grindingly predictable sports drama that tells the story of the NCAA-winning, Cinderella season of the 1966 Texas Western University Miners.",Glory Road,"['Drama', 'Sports & Fitness']"
m/1155467-glory_road,"It's one helluva story, and if this moving, and even thrilling little movie finally brings Haskins and a truly great American sports story to light, then three cheers and hooray.",Glory Road,"['Drama', 'Sports & Fitness']"
m/1155467-glory_road,"The film is engaging, even if it is somewhat lackluster",Glory Road,"['Drama', 'Sports & Fitness']"
m/1155467-glory_road,"However inspiring the actual events were, the movie feels like an opportunity lost. A powerful, significant true story like this deserves more than the ordinary.",Glory Road,"['Drama', 'Sports & Fitness']"
m/1155467-glory_road,"Viewed as a re-creation of a watershed moment, Glory Road is sturdy, efficient, perhaps even worthy. Taken as cinema, however, it falls far short of inspiring.",Glory Road,"['Drama', 'Sports & Fitness']"
m/1155467-glory_road,This season's obligatory inspirational coach-centered sports movie finds its true story at a point where sports history intersects with the struggle for racial equality.,Glory Road,"['Drama', 'Sports & Fitness']"
m/1155467-glory_road,It's a terrific story of a team of Davids with hoop dreams running a gantlet of patrician Goliaths against a backdrop of momentous social change.,Glory Road,"['Drama', 'Sports & Fitness']"
m/1155467-glory_road,First-time director James Gartner's movie is less a study of race than it is a fast break of underdog clichés and 'inspirational' speeches.,Glory Road,"['Drama', 'Sports & Fitness']"
m/1155467-glory_road,"the fact that this one's a little muddled, a little messy, often works in its favor.",Glory Road,"['Drama', 'Sports & Fitness']"
m/1155467-glory_road,"Glory Road is a rah-rah piece of inspirationalism from Disney and producer Jerry Bruckheimer, who obviously wants to go one better on his Remember the Titans.",Glory Road,"['Drama', 'Sports & Fitness']"
m/1155467-glory_road,"Glory Road, a stand-up-and-cheer basketball tale taken from real life, is a drama that, almost inevitably, falls short of its subject. But what a subject!",Glory Road,"['Drama', 'Sports & Fitness']"
m/1155467-glory_road,About as derivative and forgettable as this genre comes.,Glory Road,"['Drama', 'Sports & Fitness']"
m/1155467-glory_road,Glory Road plays fast and loose with some of the facts leading up to that event. But that certainly gives it dramatic punch.,Glory Road,"['Drama', 'Sports & Fitness']"
m/1155467-glory_road,"At 106 minutes, the slicing off of a slew of choppily interspersed subplots could have made Glory Road a leaner, meaner, message-delivery machine.",Glory Road,"['Drama', 'Sports & Fitness']"
m/1155467-glory_road,The big game at the end of the film has the momentum and rhythm of a really exciting basketball game. It's just that the 90 minutes that come before that scene aren't so great.,Glory Road,"['Drama', 'Sports & Fitness']"
m/1155467-glory_road,"Where it succeeds is as the story of a chapter in history, the story of how one coach at one school arrived at an obvious conclusion and acted on it, and helped open college sports in the South to generations of African Americans.",Glory Road,"['Drama', 'Sports & Fitness']"
m/1155467-glory_road,"The movie tries to push every button and please everyone involved, and its expressway of good intentions is little more than just a patchy re-paving job",Glory Road,"['Drama', 'Sports & Fitness']"
m/1155467-glory_road,"Disney's fact-based, sports-movie formula has become so familiar by now that watching another one of these films nearly serves as a sedative - if not outright anesthesia.",Glory Road,"['Drama', 'Sports & Fitness']"
m/1155467-glory_road,A few sizes too small for the story it wants to tell...a picture that leaves no cliche unturned in its journey to a foreordained conclusion.,Glory Road,"['Drama', 'Sports & Fitness']"
m/1155467-glory_road,"The acting is strong, the games are exciting, and despite the serious message about racial equality, it's actually pretty funny in spots.",Glory Road,"['Drama', 'Sports & Fitness']"
m/1155467-glory_road,"A successful mix of politics, social commentary and sports.",Glory Road,"['Drama', 'Sports & Fitness']"
m/1155467-glory_road,"Rages with bleacher-stomping, fist-pumping thrills you'd expect from an underdog sports movie.",Glory Road,"['Drama', 'Sports & Fitness']"
m/1155467-glory_road,"If the prospect of another reality-based Disney sports drama makes you want to pull your fingernails out with pliers, you'll be pleasantly surprised by this bio of the 1966 Texas Western Miners.",Glory Road,"['Drama', 'Sports & Fitness']"
m/1155467-glory_road,Glory Road becomes that rare sports movie that realizes that buzzer-beating shots aren't the only dramatic moments in a game.,Glory Road,"['Drama', 'Sports & Fitness']"
m/1155467-glory_road,... Deals with the issue of race about as realistically as can be expected from a Disney movie.,Glory Road,"['Drama', 'Sports & Fitness']"
m/1155467-glory_road,"Glory Road, the true-ish story of the first all-black NCAA championship basketball team, throws down a 360 slam dunk in the face of racism.",Glory Road,"['Drama', 'Sports & Fitness']"
m/1155467-glory_road,"An appealing Disney sports movie that underplays its potential, Glory Road is at least a more satisfying basketball saga than last year's Coach Carter.",Glory Road,"['Drama', 'Sports & Fitness']"
m/1155467-glory_road,"Even knowing the outcome, sports' fans will cheer the lightning-fast, dynamically edited on-court action that's only slowed by a few lumbering, heavy handed scenes.",Glory Road,"['Drama', 'Sports & Fitness']"
m/1155467-glory_road,"Lacking the gritty reality of the 1994 documentary Hoop Dreams, this Jerry Bruckheimer film, directed by newcomer James Gartner, converts a year in the life of a basketball team into a very conventional triumph of the underdogs.",Glory Road,"['Drama', 'Sports & Fitness']"
m/1155467-glory_road,"OK, so you really don't need me to tell you about Glory Road if you've ever seen a sports movie before. Just get out your sports-movie-cliché checklist and a pencil.",Glory Road,"['Drama', 'Sports & Fitness']"
m/1155467-glory_road,"Glory Road abandons the clinical and compelling storytelling of the great recent Disney hockey movie Miracle, and aims instead for the contrived sentimentality of the slightly less great Remember the Titans.",Glory Road,"['Drama', 'Sports & Fitness']"
m/1155467-glory_road,"The basketball drama Glory Road is about as smoothly predictable as a well-aimed ball arching from a hand toward a net, but is, still, inspiring.",Glory Road,"['Drama', 'Sports & Fitness']"
m/1155467-glory_road,"Somehow, Bruckheimer keeps the sentimentality to a minimum and keeps his story moving at a very nice pace: four fast quarters and a halftime.",Glory Road,"['Drama', 'Sports & Fitness']"
m/1155467-glory_road,"A nice, diverting little picture that takes no risks -- a good movie that could have been a great one.",Glory Road,"['Drama', 'Sports & Fitness']"
m/1155467-glory_road,"When a movie this corny still inspires, 'feel good' feels just right. Stay through the credits, when the 'real' coach and players talk, and you'll see the real Glory in this tale.",Glory Road,"['Drama', 'Sports & Fitness']"
m/1155467-glory_road,Heart and verve in surfeit makes the film rise above its flaws often enough to win you over.,Glory Road,"['Drama', 'Sports & Fitness']"
m/1155467-glory_road,"Really, the material is ripe for Hoop Dreams documentary treatment, but instead we get hoop hyperbole from producer Jerry Bruckheimer.",Glory Road,"['Drama', 'Sports & Fitness']"
m/1155467-glory_road,"As Coach Haskins would say, it wins because it sticks to the fundamentals.",Glory Road,"['Drama', 'Sports & Fitness']"
m/1155467-glory_road,"Glory Road is a pure Hollywood fantasy. As movie fiction, however, I guess it is entertaining enough.",Glory Road,"['Drama', 'Sports & Fitness']"
m/1155467-glory_road,"In the end, a sports movie is only as good as the adrenalin rush it provides in the climactic match, and there, finally, Glory Road hits on all cylinders with nonstop action and a powerful emotional impact.",Glory Road,"['Drama', 'Sports & Fitness']"
m/1155467-glory_road,"Glory Road's greatest strength is that it's just a great story, acted well.",Glory Road,"['Drama', 'Sports & Fitness']"
m/1155467-glory_road,"To the credit of everyone involved with Disney's Glory Road, all things familiar still become exhilarating and inspirational.",Glory Road,"['Drama', 'Sports & Fitness']"
m/1155467-glory_road,"It's a well-trod path, this 'via de basketball,' but Glory Road makes it worth the trip.",Glory Road,"['Drama', 'Sports & Fitness']"
m/1155467-glory_road,"If the facts of the story are essentially true, their presentation is as formulaic as ever.",Glory Road,"['Drama', 'Sports & Fitness']"
m/1155467-glory_road,"Glory Road doesn't live up to its title, but it plays a good game.",Glory Road,"['Drama', 'Sports & Fitness']"
m/1155467-glory_road,"Glory Road is a can't-lose slam dunk of a movie, the sort of film that charges right over its minor flaws thanks to good intentions, fine execution and a breathless air of excitement.",Glory Road,"['Drama', 'Sports & Fitness']"
m/1155467-glory_road,We've all been down this Glory Road before. But just because we've already traveled it doesn't mean it's not worth a return trip.,Glory Road,"['Drama', 'Sports & Fitness']"
m/1155467-glory_road,"All involved with the project play the game with enthusiasm and purpose, which is all we really require from a committed team and an affirmative movie like this one.",Glory Road,"['Drama', 'Sports & Fitness']"
m/1155467-glory_road,Where was Stephen A. Smith when you needed him?,Glory Road,"['Drama', 'Sports & Fitness']"
m/1155467-glory_road,"While Bruckheimer and Co. stretch the gospel theme too far and leave no emotional waypoint unmarked, Glory Road largely works.",Glory Road,"['Drama', 'Sports & Fitness']"
m/1155467-glory_road,Glory Road delivers both uplifting drama and exciting sports action in a package that's smarter than it has to be.,Glory Road,"['Drama', 'Sports & Fitness']"
m/1155467-glory_road,A well-meaning movie that slides downhill like a runaway ball of cheese.,Glory Road,"['Drama', 'Sports & Fitness']"
m/1155467-glory_road,"Glory Road ranks near the top of recent 'inspirational' sports movies, leaping over such efforts as the unsurprising Dreamer, and the fine but overly directed The Greatest Game Ever Played.",Glory Road,"['Drama', 'Sports & Fitness']"
m/1155467-glory_road,First-time director James Gartner fluidly captures the emotional crests and nadirs of such pivotal match-ups.,Glory Road,"['Drama', 'Sports & Fitness']"
m/1155467-glory_road,"Is it time already for another based-on-a-true-story feel-good Disney sports drama? Didn't that golf movie, The Greatest Game Ever Played, just come out?",Glory Road,"['Drama', 'Sports & Fitness']"
m/1155467-glory_road,"the story is convincingly told, and first-time director James Gartner builds it into a crowd-pleaser that belongs in a league with 'Remember the Titans' and 'Coach Carter.'",Glory Road,"['Drama', 'Sports & Fitness']"
m/1155467-glory_road,"In a day and age that has violent slasher flicks gobbling up movie-goers' box-office bucks, it's refreshing to see a film that stresses cooperation, effort and racial equality over shock value.",Glory Road,"['Drama', 'Sports & Fitness']"
m/1155467-glory_road,"You know the drill. Enthusiastic, hard-driving coach arrives at a backwater school and inspires his underdog team to athletic and moral victories.",Glory Road,"['Drama', 'Sports & Fitness']"
m/1155467-glory_road,"Interviews with the real-life Haskins and others during the closing credits are more interesting than the movie, and suggest the story of this incredible team will be told best in a future documentary.",Glory Road,"['Drama', 'Sports & Fitness']"
m/1155467-glory_road,The players and coaches of Texas Western changed the sport of basketball forever; Glory Road accomplishes nothing.,Glory Road,"['Drama', 'Sports & Fitness']"
m/1155467-glory_road,"...reduces a compelling, complex sports story to a fairy tale.",Glory Road,"['Drama', 'Sports & Fitness']"
m/1155467-glory_road,"It is a perfectly nice, often times thrilling, overall remarkably superficial and glossy foray into the sporting world, just barely stepping above the cliches of the genre it so often embraces upon it's way to a feel-good climax.",Glory Road,"['Drama', 'Sports & Fitness']"
m/1155467-glory_road,"For all its faults, the film brings back a forgotten moment in racial equality more vividly than a documentary on ESPN Classic.",Glory Road,"['Drama', 'Sports & Fitness']"
m/1155467-glory_road,"Like a moderately exciting amusement ride; occasionally fun, but after years of riding this same plot, the same old twists and turns get awfully tiring.",Glory Road,"['Drama', 'Sports & Fitness']"
m/1155467-glory_road,"Until inspirational sports films stop making us feel good, expect several more. This is a fun ride that will make you smile.",Glory Road,"['Drama', 'Sports & Fitness']"
m/1155467-glory_road,Succeeds at bringing an important part of sports -- and American -- history into the minds of today's audiences.,Glory Road,"['Drama', 'Sports & Fitness']"
m/1155467-glory_road,"Just substitute a basketball for the Titans' pigskin and the predictable, mildly satisfying formula works just fine.",Glory Road,"['Drama', 'Sports & Fitness']"
m/1155467-glory_road,If you have not already seen Remember the Titans or Miracle or The Rookie or Hoosiers or Coach Carter or Rudy or The Bad News Bears or The Mighty Ducks then perhaps you will love Glory Road.,Glory Road,"['Drama', 'Sports & Fitness']"
m/1155467-glory_road,"Don't demean this picture. This isn't just one of the worst sports movies of all time; it can hold its own with the worst of any genre. If you're not a basketball fan, this film is boring, manipulative, and banal. If you are a basketball fan, it's worse.",Glory Road,"['Drama', 'Sports & Fitness']"
m/1155467-glory_road,A sweaty package of sports movie cliches.,Glory Road,"['Drama', 'Sports & Fitness']"
m/1155467-glory_road,The fact that it's loosely based on a historical event doesn't change anything. Formula is formula.,Glory Road,"['Drama', 'Sports & Fitness']"
m/1155467-glory_road,Only a few quibblers are going to point out that Glory Road takes a fantastic real story and muddles it with sloppy storytelling that fails to trust the source material,Glory Road,"['Drama', 'Sports & Fitness']"
m/1155467-glory_road,"Another true(ish) story of a Vietnam-era sub-Mason-Dixon Line sports team played by and for Crackers, and the topsy-turvy struggle they must all undergo when the Blacks come and make them all feel intermittently uncomfortable and angry.",Glory Road,"['Drama', 'Sports & Fitness']"
m/1155467-glory_road,Similarities between Glory Road and Remember the Titans (2000) are purely intentional.,Glory Road,"['Drama', 'Sports & Fitness']"
m/1155467-glory_road,"Just a retread of an age old formula. The film had the potential to do something a little different with it, but didn't take the opportunity.",Glory Road,"['Drama', 'Sports & Fitness']"
m/1155467-glory_road,What is difficult to ascertain about Glory Road is where fact ends and fiction begins.,Glory Road,"['Drama', 'Sports & Fitness']"
m/1155467-glory_road,Glory Road really isn't a bad show - it's just an obvious one - and one wishes material of this historical import had received a more refined rendering.,Glory Road,"['Drama', 'Sports & Fitness']"
m/1155467-glory_road,An absorbing film.,Glory Road,"['Drama', 'Sports & Fitness']"
m/1155467-glory_road,'Glory Road' doesn't achieve cinematic glory because it fails to add personality or connect with anything below the surface.,Glory Road,"['Drama', 'Sports & Fitness']"
m/1155467-glory_road,"If you've seen all of the holiday releases, and are looking for something which won't make you run out of the theater screaming, this is a good choice.",Glory Road,"['Drama', 'Sports & Fitness']"
m/1155467-glory_road,"It was only a game, but for these seven young men, it was their way to gain respect from a predominantly white society.",Glory Road,"['Drama', 'Sports & Fitness']"
m/1155467-glory_road,Remember the Titans? Of course you do. And here's another great sports movie from Disney.,Glory Road,"['Drama', 'Sports & Fitness']"
m/1155467-glory_road,"Disney runs history through the same Hollywood melodramatic redo that made Miracle, the Olympic hockey saga, such a crowd pleaser in 2004 and The Rookie a winning baseball film in 2002.",Glory Road,"['Drama', 'Sports & Fitness']"
m/1155467-glory_road,Despite a noble effort this film comes off as 'Hoosiers' lite,Glory Road,"['Drama', 'Sports & Fitness']"
m/1155467-glory_road,The team's accomplishments are here diluted into fodder for another of the producer's feel-good man-weepies.,Glory Road,"['Drama', 'Sports & Fitness']"
m/1155467-glory_road,Disney probably issues an instruction manual to directors assigned one of its inspirational sports movies.,Glory Road,"['Drama', 'Sports & Fitness']"
m/1155467-glory_road,"It's a new year, so let's run through those sports movie clichés one more time.",Glory Road,"['Drama', 'Sports & Fitness']"
m/1155467-glory_road,Paved with self-important statements from the opening whistle ... I'm surprised Rosa Parks didn't show up for the bus ride when the Miners make the NCAA tourney to play the all-white Kentucky Wildcats,Glory Road,"['Drama', 'Sports & Fitness']"
m/1155467-glory_road,"It's a terrific story with great performances and players you care about. They shoot, they score, nothing but net in my book.",Glory Road,"['Drama', 'Sports & Fitness']"
m/1155467-glory_road,"Grappling with cliches, it's a sappy slam-dunk, formulating yet another slick underdog sports story.",Glory Road,"['Drama', 'Sports & Fitness']"
m/1155467-glory_road,It has a vague appeal and a comfortably detached way of storytelling.,Glory Road,"['Drama', 'Sports & Fitness']"
m/1155467-glory_road,"""Glory Road"" is structured as smoothly as a well-executed game plan.",Glory Road,"['Drama', 'Sports & Fitness']"
m/1155467-glory_road,I highly recommend it.,Glory Road,"['Drama', 'Sports & Fitness']"
m/1155467-glory_road,... the real drama of the first all-black starting five to win the NCAA college basketball championship deserves more complexity and character development.,Glory Road,"['Drama', 'Sports & Fitness']"
m/1155467-glory_road,Glory Road is a rousing and worthy tribute to one of the most important college basketball teams and one of the most important championship games of all time.,Glory Road,"['Drama', 'Sports & Fitness']"
m/1155467-glory_road,"Glory Road is another in a long line of feel-good sports movies about people who beat the odds through hard work and perseverance. We've seen it before, and we'll see it again. But that's OK. These films keep coming back for a reason.",Glory Road,"['Drama', 'Sports & Fitness']"
m/1155467-glory_road,"when dealing with the blatant racism depicted here, a film should be held to a higher standard",Glory Road,"['Drama', 'Sports & Fitness']"
m/1155467-glory_road,"This would be a pretty run-of-the-mill sports movie except for one thing, its historically-significant subject matter.",Glory Road,"['Drama', 'Sports & Fitness']"
m/1155467-glory_road,A great documentary could emerge from this story -- a film that deserves it.,Glory Road,"['Drama', 'Sports & Fitness']"
m/1155467-glory_road,"It's a safe and succinct tribute to a powerful true story, a breezy historical drama that aims for the gut more than the heart. And it succeeds in only that dimension, as an inescapably escapist one-course meal. But what history it has to work with.",Glory Road,"['Drama', 'Sports & Fitness']"
m/1155467-glory_road,"Well-made, well-acted and even well-directed.",Glory Road,"['Drama', 'Sports & Fitness']"
m/1155467-glory_road,All you need to know: it's a sports movie about race produced by Jerry Bruckheimer,Glory Road,"['Drama', 'Sports & Fitness']"
m/1155467-glory_road,"The problem is not that they made the wrong movie, but that the movie they decided to make wasn't very good.",Glory Road,"['Drama', 'Sports & Fitness']"
m/1155467-glory_road,"The true story is fascinating, groundbreaking and inspirational. It's a shame the cinematic treatment is predictable, conventional and trite.",Glory Road,"['Drama', 'Sports & Fitness']"
m/1155467-glory_road,The familiar territory covered here may leave you wishing for something that digs deeper into the soul of a sportsman's passion.,Glory Road,"['Drama', 'Sports & Fitness']"
m/1155467-glory_road,"A darn good story, told with enough conviction and impact to connect with people who don't know the difference between a three-pointer and a field goal.",Glory Road,"['Drama', 'Sports & Fitness']"
m/1155467-glory_road,Gartner makes a hash of the game scenes and must resort to voiceover sportscasters to explain what's happening.,Glory Road,"['Drama', 'Sports & Fitness']"
m/1155467-glory_road,"Determinado a ressaltar a importância da história que está contando, o filme mergulha em erros factuais, maniqueísmos e clichês, transformando algo significativo em puro água-com-açúcar.",Glory Road,"['Drama', 'Sports & Fitness']"
m/1155467-glory_road,...it's ultimately rather difficult not to get caught up in this inspirational true-life tale.,Glory Road,"['Drama', 'Sports & Fitness']"
m/1155467-glory_road,History wins in by-the-numbers sports flick ...,Glory Road,"['Drama', 'Sports & Fitness']"
m/1155467-glory_road,It's Remember the Titans on the basketball court. Count it right up there with the best of Disney's fine sports flicks.,Glory Road,"['Drama', 'Sports & Fitness']"
m/1155467-glory_road,"Like Hoosiers, this Jerry Bruckheimer film is a David and Goliath sports saga that holds just as much suspense and interest no matter how many times you watch it.",Glory Road,"['Drama', 'Sports & Fitness']"
m/1155467-glory_road,An underdog sports movie by the numbers.,Glory Road,"['Drama', 'Sports & Fitness']"
m/1155467-glory_road,This is the type of story that's better suited to the documentary format.,Glory Road,"['Drama', 'Sports & Fitness']"
m/1155467-glory_road,"Trying to make a sports movie for the entire family is understandable, but it makes a complicated story like Glory Road feel more like Disney than reality.",Glory Road,"['Drama', 'Sports & Fitness']"
m/1155467-glory_road,"It isn't meant to be a movie that makes us think, or that makes us uneasy in any way. It's meant to make us feel good.",Glory Road,"['Drama', 'Sports & Fitness']"
m/1155467-glory_road,"Why must Hollywood lace every African-American drama with elements of comedy, as if black people find everything comical?",Glory Road,"['Drama', 'Sports & Fitness']"
m/1155467-glory_road,"First-time director James Gartner observes all the rituals--the coach busting chops, the team sneaking out to party--but the players are indifferently characterized and the civil rights story has a fake Black History Month feel.",Glory Road,"['Drama', 'Sports & Fitness']"
m/1155467-glory_road,"Playing out like Remember The Titans for basketball fans, Glory Road is yet another would-be inspirational true story that follows sports-movie conventions.",Glory Road,"['Drama', 'Sports & Fitness']"
m/1155467-glory_road,"Glory Road doesn't have any of the individual moments that humanized Hoosiers, The Rookie, and Miracle. It's a feel-good sports movie by the numbers.",Glory Road,"['Drama', 'Sports & Fitness']"
m/1155467-glory_road,"Like most sports films Glory Road works best when it is actually showcasing its sport ... off the court, however, it's alternately flat and didactic. Director Gartner goes to great pains to drill the films message in, early and often.",Glory Road,"['Drama', 'Sports & Fitness']"
m/1155467-glory_road,"If you're a basketball fan, you'll love it. If you're a parent looking for movie inspiration for your offspring, see it as a family outing. For everyone else, Glory Road is an accessible time capsule of American history.",Glory Road,"['Drama', 'Sports & Fitness']"
m/1155467-glory_road,A very lazy movie. [Full Review in Spanish],Glory Road,"['Drama', 'Sports & Fitness']"
m/1156285-summer_storm,"Both a classical allegory of adolescence and a contemporary coming-of-age melodrama, Sommersturm's story is of course not new, but it is exquisitely told.",Summer Storm (Sommersturm),"['Art House & International', 'Comedy', 'Drama', 'Romance', 'Sports & Fitness']"
m/1156285-summer_storm,"Beautifully shot, with natural acting and sensitive storytelling that honestly grapples with difficult themes.",Summer Storm (Sommersturm),"['Art House & International', 'Comedy', 'Drama', 'Romance', 'Sports & Fitness']"
