rotten_tomatoes_link,review_content,movie_title,genre_list
m/american_outlaws,"Let's cast a lot of cute boys as the James/Younger gang. In between hold-ups, they can bicker about who's the cutest and, oh yeah, they can take their shirts off a lot.",American Outlaws,"['Action & Adventure', 'Western']"
m/american_tail_fievel_goes_west,"There is nothing really the matter with An American Tail: Fievel Goes West, except that it is not inspired with an extra spark of imagination in addition to its competent entertainment qualities.",An American Tail - Fievel Goes West,"['Action & Adventure', 'Animation', 'Kids & Family', 'Western']"
m/american_tail_fievel_goes_west,Our sweet little Fievel has been stricken with a case of sequelitis ... but it's not too bad.,An American Tail - Fievel Goes West,"['Action & Adventure', 'Animation', 'Kids & Family', 'Western']"
m/american_tail_fievel_goes_west,What can you say about a sequel that comes five years later and yet feels rushed?,An American Tail - Fievel Goes West,"['Action & Adventure', 'Animation', 'Kids & Family', 'Western']"
m/american_tail_fievel_goes_west,The further adventures of immigrant mice.,An American Tail - Fievel Goes West,"['Action & Adventure', 'Animation', 'Kids & Family', 'Western']"
m/american_tail_fievel_goes_west,Holds up as a strong and exciting animated film.,An American Tail - Fievel Goes West,"['Action & Adventure', 'Animation', 'Kids & Family', 'Western']"
m/american_tail_fievel_goes_west,"In the end, it's a pretty entertaining story with twists and turns.",An American Tail - Fievel Goes West,"['Action & Adventure', 'Animation', 'Kids & Family', 'Western']"
m/american_tail_fievel_goes_west,"Primarily aimed at children, it is a cartoon romp with the honky-tonk humor of a Looney Tunes adventure. But it is witty, well crafted-and clever enough to amuse adults.",An American Tail - Fievel Goes West,"['Action & Adventure', 'Animation', 'Kids & Family', 'Western']"
m/apache,"... not a total success, but overcomes its leaden storytelling by being muscular and accepting of the Apache culture without being patronizing.",Apache,"['Classics', 'Western']"
m/apache,Colorful and rousing.,Apache,"['Classics', 'Western']"
m/apache,"Burt Lancaster joins a long line of white actors who played native Americans in this brutal Western, directed by the young Robert Aldrich, who was forced to change the ending.",Apache,"['Classics', 'Western']"
m/apache,The radicalized howl to Broken Arrow's amenable mewl,Apache,"['Classics', 'Western']"
m/apache,Don't be misled by the commonplace title - this is one of the most exciting and entertaining westerns Hollywood has produced in a cayuse age.,Apache,"['Classics', 'Western']"
m/apple_dumpling_gang,Few people remember anything about this movie apart from the hilarity generated by this scene-stealing duo.,The Apple Dumpling Gang,"['Comedy', 'Kids & Family', 'Western']"
m/apple_dumpling_gang,"Everytime I see one of these antiseptic Disney films, I'm reminded of the thrills and genuine artistry that went into the studio's films during its golden age in the 1940s and 1950s.",The Apple Dumpling Gang,"['Comedy', 'Kids & Family', 'Western']"
m/apple_dumpling_gang,Walt Disney started by making movies in which animated drawings played the parts of people or animals who stood for people. Later he turned to making movies in which people or animals play the parts of animated drawings.,The Apple Dumpling Gang,"['Comedy', 'Kids & Family', 'Western']"
m/apple_dumpling_gang,"The traditional ingredients of homely moralising, sentimentality and raucous slapstick are used sparingly, the dialogue is fairly bright, some visual gags are neatly executed.",The Apple Dumpling Gang,"['Comedy', 'Kids & Family', 'Western']"
m/apple_dumpling_gang,"A delightful cast of character actors helps the childish story, with Conway and Knotts beginning what would become a somewhat famous, but very simple-minded, film comedy duo.",The Apple Dumpling Gang,"['Comedy', 'Kids & Family', 'Western']"
m/apple_dumpling_gang,Rollicking Old West ride lassos some stereotypes.,The Apple Dumpling Gang,"['Comedy', 'Kids & Family', 'Western']"
m/assassination_of_jesse_james_by_the_coward_robert_ford,"The plot is rather weak, but the tone is dark and haunting and the visuals stunning, not to mention Brad Pitt's stunning portrait of paranoia and fear",The Assassination of Jesse James by the Coward Robert Ford,"['Action & Adventure', 'Drama', 'Western']"
m/assassination_of_jesse_james_by_the_coward_robert_ford,It's a magnificent throwback to a time when filmmakers found all sorts of ways to refashion Hollywood's oldest and most durable genre.,The Assassination of Jesse James by the Coward Robert Ford,"['Action & Adventure', 'Drama', 'Western']"
m/assassination_of_jesse_james_by_the_coward_robert_ford,"The titular act of violence is the best scene in the film, radiating a kind of unavoidable fatality that elevates the lethal gunshot from a just another bang to something triggering a very strong sense of epochal change.",The Assassination of Jesse James by the Coward Robert Ford,"['Action & Adventure', 'Drama', 'Western']"
m/assassination_of_jesse_james_by_the_coward_robert_ford,"... gets smothered in pointlessly long takes, repetitive scenes, grim Western landscapes and mumbled, heavily accented dialogue.",The Assassination of Jesse James by the Coward Robert Ford,"['Action & Adventure', 'Drama', 'Western']"
m/assassination_of_jesse_james_by_the_coward_robert_ford,"The slow pace and the fact that the title gives away the entire plot should only be a minor annoyance to those who love strong writing, powerful acting and great filmmaking.",The Assassination of Jesse James by the Coward Robert Ford,"['Action & Adventure', 'Drama', 'Western']"
m/assassination_of_jesse_james_by_the_coward_robert_ford,"With an almost aching restraint in the performances and storytelling, Assassination makes for a quite enjoyable film if you give yourself over to its pacing and style.",The Assassination of Jesse James by the Coward Robert Ford,"['Action & Adventure', 'Drama', 'Western']"
m/assassination_of_jesse_james_by_the_coward_robert_ford,"Of all the many films about Jesse James, Andrew Dominik's epic may not end up ranking as the most popular or the best film on the subject but it will certainly, flaws and all, be regarded as the most intriguing and ambitious take on the man and his myth.",The Assassination of Jesse James by the Coward Robert Ford,"['Action & Adventure', 'Drama', 'Western']"
m/assassination_of_jesse_james_by_the_coward_robert_ford,"Loping, lyrical, contemplative, poetic, Malick-meets-David Gordon Green style.",The Assassination of Jesse James by the Coward Robert Ford,"['Action & Adventure', 'Drama', 'Western']"
m/assassination_of_jesse_james_by_the_coward_robert_ford,"Impeccably shot, cast and directed, this is a truly impressive film.",The Assassination of Jesse James by the Coward Robert Ford,"['Action & Adventure', 'Drama', 'Western']"
m/assassination_of_jesse_james_by_the_coward_robert_ford,While Pitt is fine here -- he's as enigmatic and half-seen as you'd want an icon to be -- it's Affleck who impresses.,The Assassination of Jesse James by the Coward Robert Ford,"['Action & Adventure', 'Drama', 'Western']"
m/assassination_of_jesse_james_by_the_coward_robert_ford,"A majestic biopic that digs more deeply into the character of Jesse James than has ever been done before. Will disappoint fans of shoot-em-ups, though.",The Assassination of Jesse James by the Coward Robert Ford,"['Action & Adventure', 'Drama', 'Western']"
m/assassination_of_jesse_james_by_the_coward_robert_ford,"Affleck does something remarkable here with his performance: He makes you feel sorry for this weaselly, whiny, 19-year-old kid, yet fear him at the same time.",The Assassination of Jesse James by the Coward Robert Ford,"['Action & Adventure', 'Drama', 'Western']"
m/assassination_of_jesse_james_by_the_coward_robert_ford,A psychological chamber drama in which the wide-open spaces are geographic as well as mental.,The Assassination of Jesse James by the Coward Robert Ford,"['Action & Adventure', 'Drama', 'Western']"
m/assassination_of_jesse_james_by_the_coward_robert_ford,"For fans who say they'd pay to watch Brad Pitt read the Yellow Pages -- well, your money might be better-spent on that.",The Assassination of Jesse James by the Coward Robert Ford,"['Action & Adventure', 'Drama', 'Western']"
m/assassination_of_jesse_james_by_the_coward_robert_ford,"Fact is, The Assassination is nothing more than a misreading of Hollywood mythology.",The Assassination of Jesse James by the Coward Robert Ford,"['Action & Adventure', 'Drama', 'Western']"
m/assassination_of_jesse_james_by_the_coward_robert_ford,"The extraordinary expressive performers, male and female; the haunting interior and exterior conflicts; the painstaking authenticity of the period detail; and the subtly modulated mood shifts all combine to make a modern masterpiece of an old legend.",The Assassination of Jesse James by the Coward Robert Ford,"['Action & Adventure', 'Drama', 'Western']"
m/assassination_of_jesse_james_by_the_coward_robert_ford,A haunting retelling of one of the enduring outlaw sagas in American culture.,The Assassination of Jesse James by the Coward Robert Ford,"['Action & Adventure', 'Drama', 'Western']"
m/assassination_of_jesse_james_by_the_coward_robert_ford,"Steeped in the lyrical fatalism of that last great decade for the western, the '70s, The Assassination of Jesse James by the Coward Robert Ford owes a debt to myriad spiritual ancestors.",The Assassination of Jesse James by the Coward Robert Ford,"['Action & Adventure', 'Drama', 'Western']"
m/assassination_of_jesse_james_by_the_coward_robert_ford,A slow roast of a movie that seals in all the flavors.,The Assassination of Jesse James by the Coward Robert Ford,"['Action & Adventure', 'Drama', 'Western']"
m/assassination_of_jesse_james_by_the_coward_robert_ford,Heroically pretentious.,The Assassination of Jesse James by the Coward Robert Ford,"['Action & Adventure', 'Drama', 'Western']"
m/assassination_of_jesse_james_by_the_coward_robert_ford,We are told a lot about Jesse James during the elongated run time -- but learn very little about the man at all.,The Assassination of Jesse James by the Coward Robert Ford,"['Action & Adventure', 'Drama', 'Western']"
m/assassination_of_jesse_james_by_the_coward_robert_ford,"High quality production. The dialogue in this film sings with poetry, grit, spit, and the ring of rural America circa 1880's. Not an action picture, long with a relaxed pace.",The Assassination of Jesse James by the Coward Robert Ford,"['Action & Adventure', 'Drama', 'Western']"
m/assassination_of_jesse_james_by_the_coward_robert_ford,"Pitt's subtle work -- relaxed and confident, yet seething with quiet menace -- is complemented beautifully by Affleck's enigmatic Ford, whose admiration for (and fear of) James distinguishes him from a run-of-the-mill scoundrel.",The Assassination of Jesse James by the Coward Robert Ford,"['Action & Adventure', 'Drama', 'Western']"
m/assassination_of_jesse_james_by_the_coward_robert_ford,An absolute misfire.,The Assassination of Jesse James by the Coward Robert Ford,"['Action & Adventure', 'Drama', 'Western']"
m/assassination_of_jesse_james_by_the_coward_robert_ford,The Assassination of Jesse James by the Coward Robert Ford represents a breakthrough in the moviegoing experience. It may be the first time we've been asked to watch a book on tape.,The Assassination of Jesse James by the Coward Robert Ford,"['Action & Adventure', 'Drama', 'Western']"
m/assassination_of_jesse_james_by_the_coward_robert_ford,"It's a shame that The Assassination of Jesse James, a moody epic directed by Andrew Dominik and based on the 1983 novel by Ron Hansen, never goes much deeper than that tag line.",The Assassination of Jesse James by the Coward Robert Ford,"['Action & Adventure', 'Drama', 'Western']"
m/assassination_of_jesse_james_by_the_coward_robert_ford,"The Assassination of Jesse James by the Coward Robert Ford adds another gauzy chapter to the overtaxed James myth, if not much rhyme or reason, heart or soul.",The Assassination of Jesse James by the Coward Robert Ford,"['Action & Adventure', 'Drama', 'Western']"
m/assassination_of_jesse_james_by_the_coward_robert_ford,"To put it most bluntly, the thing is just too long and too slow.",The Assassination of Jesse James by the Coward Robert Ford,"['Action & Adventure', 'Drama', 'Western']"
m/assassination_of_jesse_james_by_the_coward_robert_ford,I wish this movie wasn't so purposefully elegiac and attenuated -- at times it's like a middling Terrence Malick fantasia -- but it's well worth sitting through.,The Assassination of Jesse James by the Coward Robert Ford,"['Action & Adventure', 'Drama', 'Western']"
m/assassination_of_jesse_james_by_the_coward_robert_ford,"A surprising near-masterpiece, and the best Western to come across the range since Clint Eastwood's Unforgiven and Jim Jarmusch's Dead Man.",The Assassination of Jesse James by the Coward Robert Ford,"['Action & Adventure', 'Drama', 'Western']"
m/assassination_of_jesse_james_by_the_coward_robert_ford,"If I were inclined to wheel out cliches like ""Oscar-worthy,"" I'd certainly wheel them out in support of this movie, on several counts.",The Assassination of Jesse James by the Coward Robert Ford,"['Action & Adventure', 'Drama', 'Western']"
m/assassination_of_jesse_james_by_the_coward_robert_ford,"The Assassination of Jesse James is less of a Western than a mid-Western, which refers both to the film's urban Missouri center of gravity and its pivoting position between horse opera and backstage intrigue.",The Assassination of Jesse James by the Coward Robert Ford,"['Action & Adventure', 'Drama', 'Western']"
m/assassination_of_jesse_james_by_the_coward_robert_ford,"In its nakedly revealed tremors of fear and insecurity, Affleck's tour de force is reminiscent of the similarly raw work of the late, great John Cazale.",The Assassination of Jesse James by the Coward Robert Ford,"['Action & Adventure', 'Drama', 'Western']"
m/assassination_of_jesse_james_by_the_coward_robert_ford,Unforgivably slow and over-titled attempt to dramatize the ignoble murder of the notorious outlaw features a fine performance by Casey Affleck as Ford.,The Assassination of Jesse James by the Coward Robert Ford,"['Action & Adventure', 'Drama', 'Western']"
m/assassination_of_jesse_james_by_the_coward_robert_ford,"Dominik paints a richly detailed mosaic on locations in Calgary and Winnipeg, and you can only marvel at the visual miracles achieved by cinematographer Roger Deakins.",The Assassination of Jesse James by the Coward Robert Ford,"['Action & Adventure', 'Drama', 'Western']"
m/assassination_of_jesse_james_by_the_coward_robert_ford,"It's Dominik's uncompromising, uncommercial vision and the two leads that give the story such a wonderfully wounded grandeur.",The Assassination of Jesse James by the Coward Robert Ford,"['Action & Adventure', 'Drama', 'Western']"
m/assassination_of_jesse_james_by_the_coward_robert_ford,"Parts of the movie are brilliant in a Terrence Malick-inspired way, but the lugubrious middle section is badly in need of the hand of a ruthless editor.",The Assassination of Jesse James by the Coward Robert Ford,"['Action & Adventure', 'Drama', 'Western']"
m/assassination_of_jesse_james_by_the_coward_robert_ford,"The sheer craftsmanship on display ensures a modicum of goodwill, but at two hours and 40 minutes, even the most patient souls may begin to squirm.",The Assassination of Jesse James by the Coward Robert Ford,"['Action & Adventure', 'Drama', 'Western']"
m/assassination_of_jesse_james_by_the_coward_robert_ford,"When you watch The Assassination of Jesse James..., you've got to appreciate what Kevin Costner could do with three hours. It's an endurance test, not god awful but just not worth spending so much time on.",The Assassination of Jesse James by the Coward Robert Ford,"['Action & Adventure', 'Drama', 'Western']"
m/assassination_of_jesse_james_by_the_coward_robert_ford,"Aside from the movie's mouthful title, this [is a] contemplative and carousing exposition. [The] prairie-induced pathos is plenty to digest with absolute reverence.",The Assassination of Jesse James by the Coward Robert Ford,"['Action & Adventure', 'Drama', 'Western']"
m/assassination_of_jesse_james_by_the_coward_robert_ford,"Stunning visuals, award-worthy performances, and a script that takes incredibly rewarding risks, Jesse James is a masterpiece and one of the best films of the year.",The Assassination of Jesse James by the Coward Robert Ford,"['Action & Adventure', 'Drama', 'Western']"
m/assassination_of_jesse_james_by_the_coward_robert_ford,A masterwork that already has the feel of a classic. This take on the last days of an iconic western figure constantly surprises and intrigues.,The Assassination of Jesse James by the Coward Robert Ford,"['Action & Adventure', 'Drama', 'Western']"
m/assassination_of_jesse_james_by_the_coward_robert_ford,...heightened by a rare cinematic artistry that seamlessly melds a probing character essay with a lyrical Western epic.,The Assassination of Jesse James by the Coward Robert Ford,"['Action & Adventure', 'Drama', 'Western']"
m/assassination_of_jesse_james_by_the_coward_robert_ford,"It's a western destined to outlive the pronouncements of its own death, because it knows that death is only the first stage in the life of legend.",The Assassination of Jesse James by the Coward Robert Ford,"['Action & Adventure', 'Drama', 'Western']"
m/assassination_of_jesse_james_by_the_coward_robert_ford,"The movie is merely a long, empty exercise in style.",The Assassination of Jesse James by the Coward Robert Ford,"['Action & Adventure', 'Drama', 'Western']"
m/assassination_of_jesse_james_by_the_coward_robert_ford,"...an epic film that's part literary treatise, part mournful ballad, and completely a portrait of our world, as seen in a distant mirror.",The Assassination of Jesse James by the Coward Robert Ford,"['Action & Adventure', 'Drama', 'Western']"
m/assassination_of_jesse_james_by_the_coward_robert_ford,The Assassination of Jesse James by the Coward Robert Ford is a gorgeous snooze.,The Assassination of Jesse James by the Coward Robert Ford,"['Action & Adventure', 'Drama', 'Western']"
m/assassination_of_jesse_james_by_the_coward_robert_ford,The look and feel of the movie are as authentic as any Western since Robert Altman's McCabe and Mrs. Miller...,The Assassination of Jesse James by the Coward Robert Ford,"['Action & Adventure', 'Drama', 'Western']"
m/assassination_of_jesse_james_by_the_coward_robert_ford,"Hugely ambitious and not without moments of success, this indulgent 2 hour and 40 minute epic ends up as unwieldy as its elongated title.",The Assassination of Jesse James by the Coward Robert Ford,"['Action & Adventure', 'Drama', 'Western']"
m/assassination_of_jesse_james_by_the_coward_robert_ford,This is a masterpiece.,The Assassination of Jesse James by the Coward Robert Ford,"['Action & Adventure', 'Drama', 'Western']"
m/assassination_of_jesse_james_by_the_coward_robert_ford,"Much of the film, burdened by unnecessary, obvious narration, is an overly languid, dully paced prelude to the main event...",The Assassination of Jesse James by the Coward Robert Ford,"['Action & Adventure', 'Drama', 'Western']"
m/assassination_of_jesse_james_by_the_coward_robert_ford,"...The Assassination of Jesse James grabs on to many of the classic tropes of the Western -- the meandering passage of time, the imposing landscapes, the abiding loneliness, the casual violence -- and sets about mapping their furthest edges.",The Assassination of Jesse James by the Coward Robert Ford,"['Action & Adventure', 'Drama', 'Western']"
m/assassination_of_jesse_james_by_the_coward_robert_ford,"""Assassination"" is an epic in every way, from its wide sweeping atmospheric Alberta locations, to its meticulous and magisterial attention to period detail. Mind you, for a Western there isn't that much violence and blood, but the sense of foreboding is e",The Assassination of Jesse James by the Coward Robert Ford,"['Action & Adventure', 'Drama', 'Western']"
m/assassination_of_jesse_james_by_the_coward_robert_ford,Best name for a western of any film in history.,The Assassination of Jesse James by the Coward Robert Ford,"['Action & Adventure', 'Drama', 'Western']"
m/assassination_of_jesse_james_by_the_coward_robert_ford,"A long, ambitious, fitfully rewarding movie.",The Assassination of Jesse James by the Coward Robert Ford,"['Action & Adventure', 'Drama', 'Western']"
m/assassination_of_jesse_james_by_the_coward_robert_ford,"Casey Affleck gives an outstanding performance that proves him to be a character actor of immense creativity, clarity and composure.",The Assassination of Jesse James by the Coward Robert Ford,"['Action & Adventure', 'Drama', 'Western']"
m/assassination_of_jesse_james_by_the_coward_robert_ford,"As overlaong and pretentious as its title, The Assassination of Jesse James is worth a look almost in spite of itself.",The Assassination of Jesse James by the Coward Robert Ford,"['Action & Adventure', 'Drama', 'Western']"
m/assassination_of_jesse_james_by_the_coward_robert_ford,"When a film runs 2 hrs. 40 min., it's often because the writer is directing - so there's no one to tell him to trim 40 min. - or else!",The Assassination of Jesse James by the Coward Robert Ford,"['Action & Adventure', 'Drama', 'Western']"
m/assassination_of_jesse_james_by_the_coward_robert_ford,"A creepy and daring look into one of the most destructive, and self-destructive of American anti-heroes",The Assassination of Jesse James by the Coward Robert Ford,"['Action & Adventure', 'Drama', 'Western']"
m/assassination_of_jesse_james_by_the_coward_robert_ford,"The cinematic equivalent of a Homeric epic...an ambitious, mesmerizing evocation of the mystique of celebrity and the strange mixture of admiration and envy it generates.",The Assassination of Jesse James by the Coward Robert Ford,"['Action & Adventure', 'Drama', 'Western']"
m/assassination_of_jesse_james_by_the_coward_robert_ford,"It is no mean feat to make a boring film about Jesse James, but Andrew Dominik has pulled it off in style.",The Assassination of Jesse James by the Coward Robert Ford,"['Action & Adventure', 'Drama', 'Western']"
m/assassination_of_jesse_james_by_the_coward_robert_ford,"If you love classic and stylish mood Westerns such as McCabe and Mrs. Miller and The Long Riders, this is your film.",The Assassination of Jesse James by the Coward Robert Ford,"['Action & Adventure', 'Drama', 'Western']"
m/assassination_of_jesse_james_by_the_coward_robert_ford,"Fact is, The Assassination of Jesse James by the Coward Robert Ford should have been better. It should have followed the real focus on the story and done away with at least an hour of subplotting.",The Assassination of Jesse James by the Coward Robert Ford,"['Action & Adventure', 'Drama', 'Western']"
m/assassination_of_jesse_james_by_the_coward_robert_ford,"It is a broody psychological Western, a lot of peering out into endless prairie landscapes, as much Ingmar Bergman as John Ford, with a little bit of Heathcliff thrown in.",The Assassination of Jesse James by the Coward Robert Ford,"['Action & Adventure', 'Drama', 'Western']"
m/assassination_of_jesse_james_by_the_coward_robert_ford,"This is the year's epic western, and one wonders why it took so long to get out of the cutting room. See it.",The Assassination of Jesse James by the Coward Robert Ford,"['Action & Adventure', 'Drama', 'Western']"
m/assassination_of_jesse_james_by_the_coward_robert_ford,"A simple, clean, smart idea for a story turned into an agonizingly pretentious mess with world class cinematography and some good performances.",The Assassination of Jesse James by the Coward Robert Ford,"['Action & Adventure', 'Drama', 'Western']"
m/assassination_of_jesse_james_by_the_coward_robert_ford,"The mosaic of moods conjures something that feels both ancient and startlingly contemporary -- with the same doom-laden DNA as great druggy, fatalistic 1970s anti-Westerns like McCabe & Mrs. Miller and Pat Garrett And Billy The Kid.",The Assassination of Jesse James by the Coward Robert Ford,"['Action & Adventure', 'Drama', 'Western']"
m/assassination_of_jesse_james_by_the_coward_robert_ford,One of the most cinematically assured works of the year. Blows most tried-and-true westerns out of the water.,The Assassination of Jesse James by the Coward Robert Ford,"['Action & Adventure', 'Drama', 'Western']"
m/assassination_of_jesse_james_by_the_coward_robert_ford,"Sustained passages of eerie, Malickian beauty (an early sequence involving a train robbery feels like one of the reasons that film was invented), mixed with increasing stretches of self-conscious artiness ... It casts a spell, but only intermittently.",The Assassination of Jesse James by the Coward Robert Ford,"['Action & Adventure', 'Drama', 'Western']"
m/assassination_of_jesse_james_by_the_coward_robert_ford,Andrew Dominik has taken the familiar story and reconstructed it is such a fascinatingly abstract manner that it feels as if we are watching it unfold before our eyes for the very first time.,The Assassination of Jesse James by the Coward Robert Ford,"['Action & Adventure', 'Drama', 'Western']"
m/assassination_of_jesse_james_by_the_coward_robert_ford,This cinematic folk song embraces and celebrates the chasm between idealized outlaw myth and the unglamorous realities of frontier thievery.,The Assassination of Jesse James by the Coward Robert Ford,"['Action & Adventure', 'Drama', 'Western']"
