rotten_tomatoes_link,review_content,movie_title,genre_list
m/310_to_yuma,3:10 to Yuma is a drama well worth the journey.,3:10 to Yuma,"['Action & Adventure', 'Drama', 'Western']"
m/310_to_yuma,"Director James Mangold, who hit his stride with the Johnny Cash biopic Walk The Line, delivers another solid punch with this hard-edged and marvelously acted remake of Delmar Daves' classic 1957 western.",3:10 to Yuma,"['Action & Adventure', 'Drama', 'Western']"
m/310_to_yuma,"James Mangold's 3:10 to Yuma, an old-school Western updated for modern mores and tastes, pays due homage to its 1957 predecessor.",3:10 to Yuma,"['Action & Adventure', 'Drama', 'Western']"
m/310_to_yuma,"When a movie is as entertaining as this one, you begin to think this formerly beloved genre is due for a revival.",3:10 to Yuma,"['Action & Adventure', 'Drama', 'Western']"
m/310_to_yuma,"[Director] Mangold succeeds on his own terms, largely because the actors he's working with here, Russell Crowe and Christian Bale, so comfortably inhabit the movie, and the genre that cradles it.",3:10 to Yuma,"['Action & Adventure', 'Drama', 'Western']"
m/310_to_yuma,"You don't need to be a fan of that near-extinct genre to enjoy the movie -- sold more as a faceoff between Alpha males Russell ""Gladiator"" Crowe and Christian ""Batman"" Bale -- but it may turn you into one.",3:10 to Yuma,"['Action & Adventure', 'Drama', 'Western']"
m/310_to_yuma,This Yuma is Shane with a train.,3:10 to Yuma,"['Action & Adventure', 'Drama', 'Western']"
m/310_to_yuma,In 3:10 to Yuma director James Mangold has made himself a grand Western.,3:10 to Yuma,"['Action & Adventure', 'Drama', 'Western']"
m/310_to_yuma,"3:10 to Yuma offers plenty of guns-blazing, pulse-pounding action, but it's the excellent lead performances that stay with you.",3:10 to Yuma,"['Action & Adventure', 'Drama', 'Western']"
m/310_to_yuma,"A terrific, old-fashioned western, proof positive that sometimes, they do ""make 'em like they used to.""",3:10 to Yuma,"['Action & Adventure', 'Drama', 'Western']"
m/310_to_yuma,"It's a movie grounded in something like the credible realism of a John Ford Western but which also can appease the thirsts for blood, wit and tension harbored by fans of Quentin Tarantino.",3:10 to Yuma,"['Action & Adventure', 'Drama', 'Western']"
m/310_to_yuma,An extremely well-acted and well-directed remake of a 1957 oater based on a short story by the then-obscure Elmore Leonard.,3:10 to Yuma,"['Action & Adventure', 'Drama', 'Western']"
m/310_to_yuma,"Even with its flaws, it's a dusty horse ride that's well worth taking and more proof that the western never dies.",3:10 to Yuma,"['Action & Adventure', 'Drama', 'Western']"
m/310_to_yuma,"... gritty, hugely entertaining.",3:10 to Yuma,"['Action & Adventure', 'Drama', 'Western']"
m/310_to_yuma,"If the original overplayed its naiveté, the update of 3:10 to Yuma overplays its cynicism only to sell it out at the end.",3:10 to Yuma,"['Action & Adventure', 'Drama', 'Western']"
m/310_to_yuma,"The heart-stopping, breathtaking journey of 3:10 to Yuma reminds us just how exciting a good, old-fashioned movie can be.",3:10 to Yuma,"['Action & Adventure', 'Drama', 'Western']"
m/310_to_yuma,"[Director] Mangold has brought welcome intensity to the project, giving 3:10 to Yuma a visceral, immediate quality that makes it realistic and mythic all at the same time.",3:10 to Yuma,"['Action & Adventure', 'Drama', 'Western']"
m/310_to_yuma,Reminded me of what a rare pleasure it has become to watch a straightforward and convincing adult genre film...,3:10 to Yuma,"['Action & Adventure', 'Drama', 'Western']"
m/310_to_yuma,3:10 to Yuma started out as a pretty straightforward tale. But so much stuff has piled onto this simple structure that you can hear it creaking.,3:10 to Yuma,"['Action & Adventure', 'Drama', 'Western']"
m/310_to_yuma,"Unapologetically harsh and heedlessly entertaining despite its imperfections, the film includes two masterful performances from Crowe and Bale - actors so intense, they could wear red and intimidate a charging bull.",3:10 to Yuma,"['Action & Adventure', 'Drama', 'Western']"
m/310_to_yuma,Represents the classic western genre with a deft touch that recalls what made those movies so enjoyable in the first place.,3:10 to Yuma,"['Action & Adventure', 'Drama', 'Western']"
m/310_to_yuma,"The best Western since Unforgiven, 3:10 to Yuma is both cathartic and intelligent. While a wildly eventful action-adventure and outlaw shoot-'em-up, it's also a vibrant story of heroism, villainy and hard-earned redemption.",3:10 to Yuma,"['Action & Adventure', 'Drama', 'Western']"
m/310_to_yuma,3:10 to Yuma takes too long to decide what kind of movie it's going to be.,3:10 to Yuma,"['Action & Adventure', 'Drama', 'Western']"
m/310_to_yuma,"It's got old-timey atmosphere with just enough new-age empathy to work. Throw in plenty of gun fighting and two fine actors circling one another with glee, and you've got one hot pistol of a movie.",3:10 to Yuma,"['Action & Adventure', 'Drama', 'Western']"
m/310_to_yuma,"It remains, underneath all the decoration and heavy artillery, a good yarn.",3:10 to Yuma,"['Action & Adventure', 'Drama', 'Western']"
m/310_to_yuma,The tale never quite resonates beyond the screen.,3:10 to Yuma,"['Action & Adventure', 'Drama', 'Western']"
m/310_to_yuma,3:10 to Yuma manages to incorporate the rhythms of a contemporary action movie while maintaining a healthy respect for the tenets of the genre. That makes it a train well worth catching.,3:10 to Yuma,"['Action & Adventure', 'Drama', 'Western']"
m/310_to_yuma,James Mangold's 3:10 to Yuma restores the wounded heart of the Western and rescues it from the morass of pointless violence.,3:10 to Yuma,"['Action & Adventure', 'Drama', 'Western']"
m/310_to_yuma,Director James Mangold draws good performances from both leads as they wrestle with the predatory power structure of the old west.,3:10 to Yuma,"['Action & Adventure', 'Drama', 'Western']"
m/310_to_yuma,"Lean, almost absurdly satisfying.",3:10 to Yuma,"['Action & Adventure', 'Drama', 'Western']"
m/310_to_yuma,3:10 to Yuma struts like a show horse and kicks like a mule.,3:10 to Yuma,"['Action & Adventure', 'Drama', 'Western']"
m/310_to_yuma,"James Mangold probably won't like me calling his latest film a solid formula movie, but that's what 3:10 to Yuma is.",3:10 to Yuma,"['Action & Adventure', 'Drama', 'Western']"
m/310_to_yuma,"Mangold and the writers find the action potential in the Western format and ride the hell out of it. Fight and chase sequences are striking, even thrilling.",3:10 to Yuma,"['Action & Adventure', 'Drama', 'Western']"
m/310_to_yuma,"Great action, sets and camera work set this traditional western up for success in spite of stereotypical good guys and bad guys",3:10 to Yuma,"['Action & Adventure', 'Drama', 'Western']"
m/310_to_yuma,"Big screen entertainment that rides right next to the great ones, a blazing action-packed film that reminds you what first-rate storytelling and filmmaking is all about.",3:10 to Yuma,"['Action & Adventure', 'Drama', 'Western']"
m/310_to_yuma,"What Mangold had crafted is like a classic western in theme, but it resembles a modern movie in its pace and its complicated, multi-layered characterizations.",3:10 to Yuma,"['Action & Adventure', 'Drama', 'Western']"
m/310_to_yuma,"Crowe and Bale immerse themselves completely inside Mangold's milieu, and by the time the bullets started flying and Ben and Dan were bounding over rooftops my heart was beating in idyllic joy.",3:10 to Yuma,"['Action & Adventure', 'Drama', 'Western']"
m/310_to_yuma,"A kick-ass action film, as well as a vastly entertaining movie that proves that popcorn flicks don't have to be dumb, shallow or contemporary to be enjoyed.",3:10 to Yuma,"['Action & Adventure', 'Drama', 'Western']"
m/310_to_yuma,"These are two top-notch actors - one British, one Australian - who are utterly at home in this most American of genres.",3:10 to Yuma,"['Action & Adventure', 'Drama', 'Western']"
m/310_to_yuma,"Follows closely in the original's footsteps, except for all the business about honor, recovered self-worth and justice… There's no spiritual duel, no earned respect and debt of honor… just a broken man and a capricious one.",3:10 to Yuma,"['Action & Adventure', 'Drama', 'Western']"
m/310_to_yuma,"The lean, cerebral swagger of the 1957 western 3:10 to Yuma is stretched out and punched up with more characters, gun-shooting and horse-riding in an entertaining remake directed by James Mangold.",3:10 to Yuma,"['Action & Adventure', 'Drama', 'Western']"
m/310_to_yuma,"Russell Crowe and Christian Bale are the main reasons to see 3:10 to Yuma, a serviceable addition to the current western revival.",3:10 to Yuma,"['Action & Adventure', 'Drama', 'Western']"
m/310_to_yuma,"3:10 to Yuma has its off moments, and its unexplored potential, but for the vast majority of its running time, this is an excellently made and superbly acted throwback.",3:10 to Yuma,"['Action & Adventure', 'Drama', 'Western']"
m/310_to_yuma,"It's a remake that takes the original's premise and opens it up in a way that feels right. It's smart and solid and unflinching, especially about violence.",3:10 to Yuma,"['Action & Adventure', 'Drama', 'Western']"
m/310_to_yuma,"Bears many of the same fatalistic concerns as its 1957 predecessor, but its totally slick execution... polishes the feeling right out of them.",3:10 to Yuma,"['Action & Adventure', 'Drama', 'Western']"
m/310_to_yuma,Il aura fallut attendre jusqu'en septembre pour le premier très grand film de 2007,3:10 to Yuma,"['Action & Adventure', 'Drama', 'Western']"
m/310_to_yuma,"If you are making a do over, at least correct the original's faults.",3:10 to Yuma,"['Action & Adventure', 'Drama', 'Western']"
m/310_to_yuma,"Not quite on par with the 1957 version, perhaps, but certainly acting as a proper update instead of just a lazy rehash.",3:10 to Yuma,"['Action & Adventure', 'Drama', 'Western']"
m/310_to_yuma,Kudos to director James Mangold for not letting anything stand in the way of splendid performances in this impressive remake.,3:10 to Yuma,"['Action & Adventure', 'Drama', 'Western']"
m/310_to_yuma,Crowe and Bale deliver exactly as you'd expect. The actors are perfectly cast in their respective roles.,3:10 to Yuma,"['Action & Adventure', 'Drama', 'Western']"
m/310_to_yuma,"Crowe and Bale are a great study in contrasts, yet the two characters develop a grudging respect for each other that enriches the murky morality play that makes up the last half hour.",3:10 to Yuma,"['Action & Adventure', 'Drama', 'Western']"
m/310_to_yuma,"An extremely well made, spectacularly entertaining Western that represents director James Mangold's strongest film to date.",3:10 to Yuma,"['Action & Adventure', 'Drama', 'Western']"
m/310_to_yuma,"Breathtakingly exciting and incredibly moving, this -- far and away James Mangold's finest work -- is nothing less than a revolution. It makes the old not so much new but real again, vital and relevant.",3:10 to Yuma,"['Action & Adventure', 'Drama', 'Western']"
m/310_to_yuma,The editing is tense and there's mucho splatter but the climax is unforgivable for reasons I can't spell out -- and owes something to a recent picture I can't name.,3:10 to Yuma,"['Action & Adventure', 'Drama', 'Western']"
m/310_to_yuma,A complicated cowboy flick where you're conflicted about whether to root for the guys in the white hats or the black hats by the time the big showdown arrives.,3:10 to Yuma,"['Action & Adventure', 'Drama', 'Western']"
m/310_to_yuma,"Great cinematography takes more than plopping a camera down in a desert canyon ... though it helps. It takes John Wayne framed by a doorway. Gary Cooper's walk. Clint Eastwood's squint. Gene Hackman's grin. And, now, Russell Crowe's eyes.",3:10 to Yuma,"['Action & Adventure', 'Drama', 'Western']"
m/310_to_yuma,For my money happiness is a good western.,3:10 to Yuma,"['Action & Adventure', 'Drama', 'Western']"
m/310_to_yuma,"Not just one of this year's best films, but also one my favorite westerns ever...What an entertaining, thoughtful, relevant film this is.",3:10 to Yuma,"['Action & Adventure', 'Drama', 'Western']"
m/310_to_yuma,"A terrific movie with excellent performances from Crowe and Bale. If it doesn't find itself on the short list of Academy Award contenders, the film itself has been robbed.",3:10 to Yuma,"['Action & Adventure', 'Drama', 'Western']"
m/310_to_yuma,"Just as few people get the opportunity to exhibit intestinal fortitude when it really matters, few movies are as stirring as this remake.",3:10 to Yuma,"['Action & Adventure', 'Drama', 'Western']"
m/310_to_yuma,"At the helm of this remake, James Mangold initially risks stalling the plot with too much backstory, but then it's edge-of-your-seat action all the way.",3:10 to Yuma,"['Action & Adventure', 'Drama', 'Western']"
m/310_to_yuma,"The effort to complicate their interaction even further, however, risks implausibility in the final moments -- an unfortunate consequence of the very fine work that has gone before.",3:10 to Yuma,"['Action & Adventure', 'Drama', 'Western']"
m/310_to_yuma,"James Mangold's expert and entertaining 3:10 to Yuma demonstrates both the Western's age-old appeal, and the problems it presents to a contemporary filmmaker.",3:10 to Yuma,"['Action & Adventure', 'Drama', 'Western']"
m/310_to_yuma,"A decent Western, attractive mainly because of the acting duel between the straight-shooting Bale and the untamed Crowe.",3:10 to Yuma,"['Action & Adventure', 'Drama', 'Western']"
m/310_to_yuma,"Here we have, for the first time in years, an unabashed all-American Western.",3:10 to Yuma,"['Action & Adventure', 'Drama', 'Western']"
m/310_to_yuma,"Welcome back Western, nice to see you back on top again.",3:10 to Yuma,"['Action & Adventure', 'Drama', 'Western']"
m/310_to_yuma,"... let it be said loud and clear: In almost every respect, Mangold's new version is superior to the original.",3:10 to Yuma,"['Action & Adventure', 'Drama', 'Western']"
m/310_to_yuma,"Engaging, well made Western with exciting action sequences, a thought-provoking script and terrific performances from Bale and Crowe.",3:10 to Yuma,"['Action & Adventure', 'Drama', 'Western']"
m/310_to_yuma,"This film combines action and character, adding in realism that the previous version did not have.",3:10 to Yuma,"['Action & Adventure', 'Drama', 'Western']"
m/310_to_yuma,An attention-holding ride through rough country of both the physical and spiritual kind.,3:10 to Yuma,"['Action & Adventure', 'Drama', 'Western']"
m/310_to_yuma,"There's no point in wondering whether 3:10 to Yuma will trigger another revival of the genre. But for two exciting hours, the picture brings it fully alive once again.",3:10 to Yuma,"['Action & Adventure', 'Drama', 'Western']"
m/310_to_yuma,A well-made movie that isn't as simply expressed as its predecessor and so loses some of its mythic quality; the more you complicate westerns the less effective they often become.,3:10 to Yuma,"['Action & Adventure', 'Drama', 'Western']"
m/310_to_yuma,"A shame that it ends on this one false note, but up to that point 3.10 To Yuma fairly races along.",3:10 to Yuma,"['Action & Adventure', 'Drama', 'Western']"
m/310_to_yuma,"...Crowe and Bale are first-rate, the action satisfying.",3:10 to Yuma,"['Action & Adventure', 'Drama', 'Western']"
m/310_to_yuma,"New Zealand's Russell Crowe and Britain's Christian Bale, donning the hats and accents to play outlaw and escort with grizzled assurance.",3:10 to Yuma,"['Action & Adventure', 'Drama', 'Western']"
m/310_to_yuma,"A terrific turn by Peter Fonda, as a leathery bounty hunter hell-bent on retribution, is a bonus in a film far livelier than anyone had a right to expect.",3:10 to Yuma,"['Action & Adventure', 'Drama', 'Western']"
m/310_to_yuma,A great anti-buddy movie.,3:10 to Yuma,"['Action & Adventure', 'Drama', 'Western']"
m/310_to_yuma,"Despite a faintly anti-climactic ending, there's plenty of entertainment in this robust, old-fashioned western tale.",3:10 to Yuma,"['Action & Adventure', 'Drama', 'Western']"
m/310_to_yuma,An entertaining but generally underwhelming effort that squanders the talents of a great cast and comes with one of the daftest endings in years.,3:10 to Yuma,"['Action & Adventure', 'Drama', 'Western']"
m/310_to_yuma,"A remake of a 1957 movie starring Glenn Ford, Yuma's pacing may owe something to the contemporary action movie, but the themes are age-old: redemption, morality and the lure of the lawless wilderness and of the killers who call it home.",3:10 to Yuma,"['Action & Adventure', 'Drama', 'Western']"
m/310_to_yuma,"In 1957, the climax looked like Hollywood wish-fulfilment. Fifty years later, it still does.",3:10 to Yuma,"['Action & Adventure', 'Drama', 'Western']"
m/310_to_yuma,"Revolving around two very different but equally impressive performances from its leads, James Mangold's remake is everything you want from a western: stunning vistas, gripping shoot-outs and a morally complex core that is compelling to the end.",3:10 to Yuma,"['Action & Adventure', 'Drama', 'Western']"
m/310_to_yuma,"Pitting Chris against Russ, Yuma harks back to B-movie westerns but fails to tap its A-list stars' potential. Those who aren't diehard fans of the genre might want to catch a different train.",3:10 to Yuma,"['Action & Adventure', 'Drama', 'Western']"
m/310_to_yuma,"They don't make them like that anymore. But, hang on, they just did!",3:10 to Yuma,"['Action & Adventure', 'Drama', 'Western']"
m/310_to_yuma,"The two leads' sparking byplay, Crowe's addled cockiness versus Bale's nervy grit, would grace any surroundings, but it's a pleasure to revisit the frontier in a drama which feels far more vital than mere nostalgic homage.",3:10 to Yuma,"['Action & Adventure', 'Drama', 'Western']"
m/310_to_yuma,3:10 to Yuma builds up a full head of steam and sustains it.,3:10 to Yuma,"['Action & Adventure', 'Drama', 'Western']"
m/310_to_yuma,Yet another stirring example that The Western is still very much alive and kicking.,3:10 to Yuma,"['Action & Adventure', 'Drama', 'Western']"
m/310_to_yuma,"3:10 submits that the American West is a function of capitalism, expedience and exploitation of resources. That's not to say morality isn't a useful measure, it's just relative.",3:10 to Yuma,"['Action & Adventure', 'Drama', 'Western']"
m/310_to_yuma,"The studiousness, or maybe affectation, that has informed Mangold's visual style has now been applied to the reproduction of classic Western moviemaking.",3:10 to Yuma,"['Action & Adventure', 'Drama', 'Western']"
m/310_to_yuma,"The close confines of cinematographer Phedon Papamichael's camera, coupled with brilliant dialogue delivered by great actors on top of their game, allow us to overlook the letdown of a finale.",3:10 to Yuma,"['Action & Adventure', 'Drama', 'Western']"
m/310_to_yuma,It honors both the genre and the original film without doing harm to either while containing enough of its own virtues to allow it to stand alone as its own entity.,3:10 to Yuma,"['Action & Adventure', 'Drama', 'Western']"
m/310_to_yuma,"3:10 to Yuma is that rarity -- an action Western pushed into overdrive by its complicated, savvy characters.",3:10 to Yuma,"['Action & Adventure', 'Drama', 'Western']"
m/310_to_yuma,"Boasting a taut script, precise mise-en-scene, and stellear acting from Russell Crowe and Chistian Bale, this oater immediately posits itself as an A-Level Western, much more than an honorable remake of the 1957 film. Will it revive the genre?",3:10 to Yuma,"['Action & Adventure', 'Drama', 'Western']"
m/310_to_yuma,"Yuma portrays a West that is stark, barren, and morally ambiguous. Like all the great ""revisionist westerns"" of recent years, very few characters are all good or all bad.",3:10 to Yuma,"['Action & Adventure', 'Drama', 'Western']"
m/310_to_yuma,"As played by Bale, Evans' intensity is allowed to slowly burn through his quiet facade, until the man he once was returns.",3:10 to Yuma,"['Action & Adventure', 'Drama', 'Western']"
m/310_to_yuma,Shooting a western in this day and age would be either brilliant because it hasn't been done in so long or Hollywood suicide. It turned out to be bit of both.,3:10 to Yuma,"['Action & Adventure', 'Drama', 'Western']"
m/310_to_yuma,"Mangold delivers a taut modern take on a lesser classic, preserving the High Noon themes about doing the right thing against all odds, and injecting a more modern pacing and urgency without going overboard.",3:10 to Yuma,"['Action & Adventure', 'Drama', 'Western']"
m/310_to_yuma,"[Mangold] builds tension not only in the mano-a-mano scenes between Bale and Crowe, but also when throwing in a wild card, such as Mol's gentle Alice.",3:10 to Yuma,"['Action & Adventure', 'Drama', 'Western']"
m/310_to_yuma,"This is a fine, handsomely staged movie, as exciting and stimulating as anything I've seen this year.",3:10 to Yuma,"['Action & Adventure', 'Drama', 'Western']"
m/310_to_yuma,Russell Crowe and Christian Bale make terrific foes in this classic western tale.,3:10 to Yuma,"['Action & Adventure', 'Drama', 'Western']"
m/310_to_yuma,"The new ""3:10 To Yuma"" is an excellent horse opera. Catch it before it leaves town.",3:10 to Yuma,"['Action & Adventure', 'Drama', 'Western']"
m/310_to_yuma,"The film is sharply written, although you must take a monumental leap of faith to buy into the ending that unfolds.",3:10 to Yuma,"['Action & Adventure', 'Drama', 'Western']"
m/310_to_yuma,"As well-done as the set pieces are, giving the film its more substantive dramatic kick is the psychological warfare.",3:10 to Yuma,"['Action & Adventure', 'Drama', 'Western']"
m/310_to_yuma,"There's no true grit to be found in James Mangold's fun but safe Western remake. Nitpicking, however, is no way to treat a movie that gives us two heavyweights like Russell Crowe and Christian Bale on top of their games.",3:10 to Yuma,"['Action & Adventure', 'Drama', 'Western']"
m/310_to_yuma,"Westerns may be old fashioned, but as old-school homages go, superb writing and compelling acting will never go out of style.",3:10 to Yuma,"['Action & Adventure', 'Drama', 'Western']"
m/310_to_yuma,Russell Crowe plays his role as Ethan Edwards for the post 9/11 western.,3:10 to Yuma,"['Action & Adventure', 'Drama', 'Western']"
m/310_to_yuma,Crowe and Bale captivate in Western remake.,3:10 to Yuma,"['Action & Adventure', 'Drama', 'Western']"
m/310_to_yuma,"Remains an evocative morality tale about what makes men good, what makes them bad and what makes them ugly.",3:10 to Yuma,"['Action & Adventure', 'Drama', 'Western']"
m/310_to_yuma,"A contender for one of my favorites of 2007, and damn near superior to its predecessor...",3:10 to Yuma,"['Action & Adventure', 'Drama', 'Western']"
m/310_to_yuma,"Christian Bale is having a standout year, it started with his amazing work in Rescue Dawn and quickly followed up with this.",3:10 to Yuma,"['Action & Adventure', 'Drama', 'Western']"
m/310_to_yuma,Mangold's film is more than sufficiently subtexty and cynical for our modern sensibilities while simultaneously embracing Mangold's obvious pleasure in the Westerns' time-honored swinging saloon doors and stern masculine traditions.,3:10 to Yuma,"['Action & Adventure', 'Drama', 'Western']"
m/310_to_yuma,[Mangold's] examination of the moral complexities of his two main characters makes this an intriguingly timely as well as timeless story.,3:10 to Yuma,"['Action & Adventure', 'Drama', 'Western']"
m/310_to_yuma,"If 3:10 to Yuma can't resuscitate the western, nothing will.",3:10 to Yuma,"['Action & Adventure', 'Drama', 'Western']"
m/310_to_yuma,The film is a creditable remake - no better than the original but different enough to stand on its considerable merits.,3:10 to Yuma,"['Action & Adventure', 'Drama', 'Western']"
m/310_to_yuma,"Cinematic and wonderful on the big screen, this magnificent remake revisits the grandeur of the western, tossing around elements of morality in the melee of good pitted against evil... Russell Crowe is splendid.",3:10 to Yuma,"['Action & Adventure', 'Drama', 'Western']"
m/310_to_yuma,"Não sei se o cineasta pretendia homenagear um de seus filmes favoritos ao empalidecê-lo, mas, para o bem ou para o mal, foi isto que acabou fazendo.",3:10 to Yuma,"['Action & Adventure', 'Drama', 'Western']"
m/310_to_yuma,"3:10 to Yuma is riveting, exciting and rare %u2014 a thinking person's Western.",3:10 to Yuma,"['Action & Adventure', 'Drama', 'Western']"
m/310_to_yuma,Uneven yet entertaining...,3:10 to Yuma,"['Action & Adventure', 'Drama', 'Western']"
m/310_to_yuma,Christian Bale had me in the first few seconds when he started limping toward the window,3:10 to Yuma,"['Action & Adventure', 'Drama', 'Western']"
m/310_to_yuma,One of the year's most enjoyable films.,3:10 to Yuma,"['Action & Adventure', 'Drama', 'Western']"
m/310_to_yuma,The western has been buried and revived so many times in recent years that it's beginning to resemble one of George Romero's stale zombies...,3:10 to Yuma,"['Action & Adventure', 'Drama', 'Western']"
m/310_to_yuma,"I was surprised at how engaged I remained throughout almost the entire movie, and much of that credit might have to go to the film's dual leads, Christian Bale and Russell Crowe...",3:10 to Yuma,"['Action & Adventure', 'Drama', 'Western']"
m/310_to_yuma,"[I]f you're looking for an Unforgiven-style reinvention of the Western, prepare for disappointment.",3:10 to Yuma,"['Action & Adventure', 'Drama', 'Western']"
m/310_to_yuma,"A mini-epic on the historical changes of the old west...serving as a just tribute to earlier, classic westerns such as The Searchers and, more recently, Unforgiven.",3:10 to Yuma,"['Action & Adventure', 'Drama', 'Western']"
m/310_to_yuma,"It's not too often that a remake holds up to the original, but Mangold's rendition blows the 1957 version out of the water in every imaginable way possible.",3:10 to Yuma,"['Action & Adventure', 'Drama', 'Western']"
