rotten_tomatoes_link,review_content,movie_title,genre_list
m/1000123-310_to_yuma,"Despite an abundance of talk, this 1957 film is often considered [Daves'] best.",3:10 to Yuma,"['Classics', 'Drama', 'Western']"
m/1000123-310_to_yuma,"Fine Daves, Ford collaborative western",3:10 to Yuma,"['Classics', 'Drama', 'Western']"
m/1000123-310_to_yuma,It's rather talky but always remains lively and tense.,3:10 to Yuma,"['Classics', 'Drama', 'Western']"
m/1000123-310_to_yuma,A taut Western (obviously inspired by High Noon) about a lone man bravely standing on principle when all others have abandoned him. Marred only by a phony ending.,3:10 to Yuma,"['Classics', 'Drama', 'Western']"
m/1000123-310_to_yuma,"It's of necessity a talkative film, with Ford working on Heflin's nerves in a stream of Machiavellian banter, but one held in perfect balance by Daves, who keeps the tension strung taut.",3:10 to Yuma,"['Classics', 'Drama', 'Western']"
m/1000123-310_to_yuma,This is a first-rate action picture -- a respectable second section to High Noon.,3:10 to Yuma,"['Classics', 'Drama', 'Western']"
m/1000123-310_to_yuma,The enjoyment here that outweighs the film's derivativeness comes in the dialogue and relationship developed between outlaw and rancher.,3:10 to Yuma,"['Classics', 'Drama', 'Western']"
m/1000123-310_to_yuma,"Made in the vein of The Gunfighter and High Noon, this mature psychological Western is arguably Delmer Daves best film, featuring Van Heflin (in the Gary Cooper role) and Glenn Ford as the bad-good guy at their most appealing and accomplished.",3:10 to Yuma,"['Classics', 'Drama', 'Western']"
m/1000123-310_to_yuma,"That the climax fizzles must be laid on doorstep of Halsted Welles, who adapts Elmore Leonard's story quite well until that point.",3:10 to Yuma,"['Classics', 'Drama', 'Western']"
m/1000123-310_to_yuma,"During the 1950s, the Western grew a conscience.",3:10 to Yuma,"['Classics', 'Drama', 'Western']"
m/1000123-310_to_yuma,An enjoyable western that's an excellent reminder of how - in the world of movies - sometimes less is best.,3:10 to Yuma,"['Classics', 'Drama', 'Western']"
m/1000123-310_to_yuma,"Though masterful in stretches, it ultimately mistakes feel-good qualities for truly satisfying ones.",3:10 to Yuma,"['Classics', 'Drama', 'Western']"
m/1000123-310_to_yuma,The new 3:10 to Yuma will have to be quite a film to stand up to the original.,3:10 to Yuma,"['Classics', 'Drama', 'Western']"
m/1000123-310_to_yuma,A sturdy genre piece.,3:10 to Yuma,"['Classics', 'Drama', 'Western']"
m/1000123-310_to_yuma,"The minutes tick toward 3:10, and all we can do is watch and hope that it all turns out ok. That's the best kind of Western, one that allows feelings like that to emerge while watching.",3:10 to Yuma,"['Classics', 'Drama', 'Western']"
m/1000123-310_to_yuma,No amount of climactic train smoke can mask the fact that the finale is fancifully optimistic gibberish.,3:10 to Yuma,"['Classics', 'Drama', 'Western']"
m/1000123-310_to_yuma,"Although not as nerve-wracking as High Noon, 3:10 to Yuma is even more claustrophobic… and the two-character drama is more intriguing than High Noon's protagonist standing alone.",3:10 to Yuma,"['Classics', 'Drama', 'Western']"
m/1000123-310_to_yuma,The film is something of a classic and boasts a terrific ending.,3:10 to Yuma,"['Classics', 'Drama', 'Western']"
m/1000123-310_to_yuma,"A portrait of storytelling made for and by the Silent Generation, an audience all too familiar with the world's spooky, white-knuckled moral twilight.",3:10 to Yuma,"['Classics', 'Drama', 'Western']"
m/1000123-310_to_yuma,"Daves isn't interested in cynicism. Redemption is probably too big a stretch as well, but there's plenty of room in-between.",3:10 to Yuma,"['Classics', 'Drama', 'Western']"
m/1000123-310_to_yuma,"Distinguished by its thoughtfulness regarding the nature of Western heroism, as defined not only by dead-eye gunplay, but by family, community, and moral rectitude. [Criterion Blu-ray]",3:10 to Yuma,"['Classics', 'Drama', 'Western']"
m/1000123-310_to_yuma,"Like The Gunfighter and Winchester '73, 3:10 to Yuma is one of those defining '50s Westerns that is well-known by film buffs but has never reached the familiarity level of a High Noon or Shane.",3:10 to Yuma,"['Classics', 'Drama', 'Western']"
m/1000123-310_to_yuma,The compositions evoke a kind of open-air claustrophobia ...,3:10 to Yuma,"['Classics', 'Drama', 'Western']"
m/1000123-310_to_yuma,It is hard to imagine a better Ben Wade than Glenn Ford.,3:10 to Yuma,"['Classics', 'Drama', 'Western']"
m/1000123-310_to_yuma,"Mind games replace gunplay to the point that, while the film's running time doesn't outstay its welcome, those expecting a nonstop shootout extravaganza may leave unsatisfied.",3:10 to Yuma,"['Classics', 'Drama', 'Western']"
m/1000560-alamo,The Alamo is an engaging and spectacular tribute to the power of filmmaking - both as socio-historic document and as a flashlight into the hearts of its participants.,The Alamo,"['Action & Adventure', 'Classics', 'Drama', 'Western']"
m/1000560-alamo,"There's a lot of talky drama and it takes more than two hours before you get to the fighting, but it remains an American epic.",The Alamo,"['Action & Adventure', 'Classics', 'Drama', 'Western']"
m/1000560-alamo,"Could Wayne have crafted a better film if he only tried his hand at directing, instead of putting on the hero's mantle as well? Doubtful.",The Alamo,"['Action & Adventure', 'Classics', 'Drama', 'Western']"
m/1000560-alamo,"Wildly overwrought, clumsy, and embarassingly directed.",The Alamo,"['Action & Adventure', 'Classics', 'Drama', 'Western']"
m/1000560-alamo,"John Wayne doesn't appear for the first twenty minutes of The Alamo, his 1960 directorial debut, and that's a bad sign.",The Alamo,"['Action & Adventure', 'Classics', 'Drama', 'Western']"
m/1000560-alamo,"Duke does Alamo redux. Heroic, overblown, speechy.",The Alamo,"['Action & Adventure', 'Classics', 'Drama', 'Western']"
m/1000560-alamo,"As his own producer and director, Mr. Wayne has unfortunately let his desire to make a ""big"" picture burden him with dialogue. His action scenes are usually vivid, his talk scenes are long and usually dull.",The Alamo,"['Action & Adventure', 'Classics', 'Drama', 'Western']"
m/1000560-alamo,Patriotic but inaccurate epic Western.,The Alamo,"['Action & Adventure', 'Classics', 'Drama', 'Western']"
m/1000560-alamo,"An elephantine, historically inaccurate, stridently patriotic tribute to the handful of Texans who faced assault by 7,000 Mexican baddies.",The Alamo,"['Action & Adventure', 'Classics', 'Drama', 'Western']"
m/1000560-alamo,"Despite a banal and preachy script, full of speeches about religion and patriotism,the film has some good action sequences; overall, it's not worse than the 2004 remake starring Billy Bob Thornton.",The Alamo,"['Action & Adventure', 'Classics', 'Drama', 'Western']"
m/1000560-alamo,"In spite of the painstaking attempts to explore the characters of the picture's three principal heroes (Bowie, Crockett, Travis), there is an absence of emotional feeling, of a sense of participation.",The Alamo,"['Action & Adventure', 'Classics', 'Drama', 'Western']"
m/1000560-alamo,"All the pontificating about the joys of freedom becomes irritating, but James Edward Grant's dialogue occasionally crackles with enough humorous wit to hold an audience untill the gripping finale.",The Alamo,"['Action & Adventure', 'Classics', 'Drama', 'Western']"
m/1000560-alamo,Interminable.,The Alamo,"['Action & Adventure', 'Classics', 'Drama', 'Western']"
m/1000560-alamo,"The film is sometimes too gabby and too sentimental but is magnificent to look at, and the inexorable climax is awesome in its scope and fury.",The Alamo,"['Action & Adventure', 'Classics', 'Drama', 'Western']"
m/10008613-burrowers,J.T Petty takes viewers on an unusual and frightening venture into the Old West with The Burrowers.,The Burrowers,"['Horror', 'Mystery & Suspense', 'Western']"
m/10008613-burrowers,"Beautifully shot and tightly scripted, it's the rare Hollywood genre film that's more concerned with human relationships and behavior than the mysterious supernatural forces that sets the action in motion.",The Burrowers,"['Horror', 'Mystery & Suspense', 'Western']"
m/10008613-burrowers,"The pacing is too pokey by half, and the payoff is a wrenching disappointment.",The Burrowers,"['Horror', 'Mystery & Suspense', 'Western']"
m/10008613-burrowers,"Sets you up for 'predictability' in both the western and horror departments, and then subverts those expectations time and again.",The Burrowers,"['Horror', 'Mystery & Suspense', 'Western']"
m/10008613-burrowers,"At his most placid, JT Petty can make Terrence Malick look like Guy Ritchie. But when he's not going full-'bore', his quiet, creepy brand of terror works on several levels.",The Burrowers,"['Horror', 'Mystery & Suspense', 'Western']"
m/10008613-burrowers,...a sporadically entertaining yet thoroughly ineffective misfire.,The Burrowers,"['Horror', 'Mystery & Suspense', 'Western']"
m/10008613-burrowers,"Petty is pursuing a more measured, sympathetic take on demons that feast on the gelatinous innards of innocent victims, manufacturing a tediously wandering picture that craves substance while itching to entertain its absurd grindhouse sensibilities.",The Burrowers,"['Horror', 'Mystery & Suspense', 'Western']"
m/10008613-burrowers,rewarding both as a horror film and a period piece.,The Burrowers,"['Horror', 'Mystery & Suspense', 'Western']"
m/10008613-burrowers,... proves once again that the old west still isn't the ideal place to set a monster movie.,The Burrowers,"['Horror', 'Mystery & Suspense', 'Western']"
m/10008613-burrowers,Director J.T Petty's nasty romp followed up Alex Turner's Dead Birds (2004) and preceeded John Geddes Exit Humanity (2011) in the Old West/monster movie mash-up genre; it may well be the best of them.,The Burrowers,"['Horror', 'Mystery & Suspense', 'Western']"
m/10008613-burrowers,... a real western/horror/monster movie with a devoted frontier sensibility and loving nods to The Searchers.,The Burrowers,"['Horror', 'Mystery & Suspense', 'Western']"
m/10008613-burrowers,"""The Burrowers"" is a very good movie, maybe the best I've seen in quite a while.",The Burrowers,"['Horror', 'Mystery & Suspense', 'Western']"
m/10008785-appaloosa,"Old fashioned Western, a meditation on honor, courage and camaraderie, is well helmed and acted, but commercially, it might fall between the cracks: It's too grown-up for young viewers and too familiar as a psychological Western for adults.",Appaloosa,"['Action & Adventure', 'Western']"
m/10008785-appaloosa,"A finely textured, riveting Western that marks a welcome return to a classic American genre. Bristles with violence and humanity",Appaloosa,"['Action & Adventure', 'Western']"
m/10008785-appaloosa,It is the romance that sets Appaloosa apart.,Appaloosa,"['Action & Adventure', 'Western']"
m/10008785-appaloosa,...modern in its playfulness while never seeming not of its period. Harris and Mortensen are good enough together to warrant another adventure.,Appaloosa,"['Action & Adventure', 'Western']"
m/10008785-appaloosa,"When you're lookin for an Olde Time, pistol-wieldin', rootin', tootin' varmint, hire somebody other than Jeremy Irons. What is this--Bonanza Revisited?",Appaloosa,"['Action & Adventure', 'Western']"
m/10008785-appaloosa,"While he thankfully avoids the actor-filmmaker avenger fantasies of The Three Burials of Melquiades Estrada, Harris doesn't have the genre chops to fill Appaloosa's empty spaces.",Appaloosa,"['Action & Adventure', 'Western']"
m/10008785-appaloosa,"Appaloosa is a pleasingly spacious piece of work, but for all of its little tangles it never musters the kick of a psychological duel.",Appaloosa,"['Action & Adventure', 'Western']"
m/10008785-appaloosa,Appaloosa demonstrates a better sense of history than Paul Thomas Anderson's hysterical There Will Be Blood. But Harris isn't a good enough director; he loses the mythical air that drives home a great Western's point.,Appaloosa,"['Action & Adventure', 'Western']"
m/10008785-appaloosa,"Ed Harris reunites with Viggo Mortensen, his co-star in A History of Violence, and the chemistry is easygoing and understated. But he should have left the direction to someone else.",Appaloosa,"['Action & Adventure', 'Western']"
m/10008785-appaloosa,It's high time for the western to be resuscitated as a genre; a picture that just pokes along amiably isn't enough to get the job done.,Appaloosa,"['Action & Adventure', 'Western']"
m/10008785-appaloosa,"The bullets may not be comparable to the Yuma remake or Kevin Costner's underrated Open Range, but the men holding the guns are still the same. So what if they're just a little bit different?",Appaloosa,"['Action & Adventure', 'Western']"
m/10008785-appaloosa,"too authentic to be populist, yet too familiar to transcend the genre and hang with the bona fide classics.",Appaloosa,"['Action & Adventure', 'Western']"
m/10008785-appaloosa,Bring back Hopalong Cassidy and Randolph Scott and you've got the making of a respectable horse opera.,Appaloosa,"['Action & Adventure', 'Western']"
m/10008785-appaloosa,Appaloosa is gripping entertainment that keeps springing surprises.,Appaloosa,"['Action & Adventure', 'Western']"
m/10008785-appaloosa,"A satisfying journey that doesn't require too much examination, just an appreciation of the scenery and what it took to get by during this period of American history.",Appaloosa,"['Action & Adventure', 'Western']"
m/10008785-appaloosa,"In the early going, Appaloosa does an efficient job of establishing the tense standoff between lawmen-for-hire Ed Harris and Viggo Mortensen, and a tyrannical rancher (an extravagantly sinister Jeremy Irons).",Appaloosa,"['Action & Adventure', 'Western']"
m/10008785-appaloosa,"If you're someone who orders the usual and is just happy when it comes out warm and fresh, I reckon Appaloosa will sit with you just fine.",Appaloosa,"['Action & Adventure', 'Western']"
m/10008785-appaloosa,"Crackling eccentric verbal wit as Harris' marshal seeks to 'button up this town tighter than a nun's corset' while overcome by Zellweger's irresistible flirty charms, because she 'chews her food nicely and even takes a bath before going to bed.",Appaloosa,"['Action & Adventure', 'Western']"
m/10008785-appaloosa,Appaloosa satisfies all its requirements but never breaks a sweat.,Appaloosa,"['Action & Adventure', 'Western']"
m/10008785-appaloosa,"It could be said that Harris and his co-writer, Robert Knott, haven't done a whole lot of writing, but as Cole himself might say, there's no need to get all fancy with what's plain and true.",Appaloosa,"['Action & Adventure', 'Western']"
m/10008785-appaloosa,"Appaloosa has a solid enough opening, and it should be fun just to watch things play out, what with the shootouts, the trains, the swagger at gunpoint. But the script (co-written by Harris) is alternately dumb and lifeless.",Appaloosa,"['Action & Adventure', 'Western']"
m/10008785-appaloosa,"Appaloosa will probably just ride off into the sunset without much of an impact, but it will sate your fix for horses, guns and slapping leather. You know, if you're into that sort of thing.",Appaloosa,"['Action & Adventure', 'Western']"
m/10008785-appaloosa,"Mannered, episodic and slow.",Appaloosa,"['Action & Adventure', 'Western']"
m/10008785-appaloosa,It's a pleasure to watch such gifted actors interact in a classic genre.,Appaloosa,"['Action & Adventure', 'Western']"
m/10008785-appaloosa,"It's both dull and preposterous, which neither Dean Semler's somberly handsome score nor Jeff Beals' pushy, cornball score does anything to ameliorate.",Appaloosa,"['Action & Adventure', 'Western']"
m/10008785-appaloosa,Harris follows his strong helming debut Pollock with a contribution to the western movie revival that looks and sounds like a classic.,Appaloosa,"['Action & Adventure', 'Western']"
m/10008785-appaloosa,"Ed Harris has the kind of head that would look great on a coin, but it looks even better on a movie screen, as he turns his chiseled features this way and that.",Appaloosa,"['Action & Adventure', 'Western']"
m/10008785-appaloosa,"Beautifully photographed by Dean Semler, Appaloosa is the best Western since Open Range and shows there's still life in this most unfashionable of genres.",Appaloosa,"['Action & Adventure', 'Western']"
m/10008785-appaloosa,"Though the leads do fine work, their efforts often feel slightly futile.",Appaloosa,"['Action & Adventure', 'Western']"
m/10008785-appaloosa,"It's unfortunate for everyone concerned, and for the film, that the train chugs into town one day.",Appaloosa,"['Action & Adventure', 'Western']"
m/10008785-appaloosa,"Throughout, the repartee between Harris and Mortensen never feels less than broken-in and believable.",Appaloosa,"['Action & Adventure', 'Western']"
m/10008785-appaloosa,"Luscious enough photography and fun to watch, ""Appaloosa"" brings nothing new to the table. As a collection of things that have been done before who will watch it over the originals?",Appaloosa,"['Action & Adventure', 'Western']"
m/10008785-appaloosa,"Appaloosa shows a square jaw and a steely gaze, but also a smile and a wink.",Appaloosa,"['Action & Adventure', 'Western']"
m/10008785-appaloosa,"The top-heavy plot takes over, and the picture makes a beeline back to tepid convention.",Appaloosa,"['Action & Adventure', 'Western']"
m/10008785-appaloosa,"A smart and funny script, highly entertaining from the first draw, Appaloosa is a taut, captivating tale of the old West with enough bite and modern edge to draw in both fans and non-devotees of the cowboy genre.",Appaloosa,"['Action & Adventure', 'Western']"
m/10008785-appaloosa,"Jeremy Irons is miscast as the film's politically driven baddie, but the easy rapport between Harris and Mortensen more than compensates for the minor misstep.",Appaloosa,"['Action & Adventure', 'Western']"
m/10008785-appaloosa,"The parts of it that work, work very well... so much so in fact that the parts which don't simply can't keep up.",Appaloosa,"['Action & Adventure', 'Western']"
m/10008785-appaloosa,"Ed Harris and Viggo Mortensen have mastered the art of subtle communication, amplifying the believability of their relationship in this ruggedly male bonding tale.",Appaloosa,"['Action & Adventure', 'Western']"
m/10008785-appaloosa,"Harris and Mortensen are out to get Irons, and their plan appears to be to talk him to death. It took a lot of stretching to get this to last for two hours.",Appaloosa,"['Action & Adventure', 'Western']"
m/10008785-appaloosa,Where the film lets you down is in the boundaries of the dramatic map which needs a more dynamic (and cinematic) driving force.,Appaloosa,"['Action & Adventure', 'Western']"
m/10008785-appaloosa,The various symbols never coalesce into metaphor so much as they stand stagnant and hollow at the edges of the frame.,Appaloosa,"['Action & Adventure', 'Western']"
m/10008785-appaloosa,"In all, Appaloosa is good as far as it goes -- everything in it feels true -- but I wish that Harris had pushed his ideas further.",Appaloosa,"['Action & Adventure', 'Western']"
m/10008785-appaloosa,"Appaloosa is entertaining, certainly, but it feels rather slight and feeble next to some of its more superior recent cohorts in the western genre.",Appaloosa,"['Action & Adventure', 'Western']"
m/10008785-appaloosa,"Can Ed Harris, of all people, save the Western for this generation?",Appaloosa,"['Action & Adventure', 'Western']"
m/10008785-appaloosa,Squinting Zellweger ruins it. I liked the hats.,Appaloosa,"['Action & Adventure', 'Western']"
m/10008785-appaloosa,"In another era, Harris -- and Mortensen, for that matter -- would have already starred in several westerns. Harris should do more of them; only next time, much less carefully.",Appaloosa,"['Action & Adventure', 'Western']"
m/10008785-appaloosa,"The best western since 3:10 to Yuma, which is to say it's a western.",Appaloosa,"['Action & Adventure', 'Western']"
m/10008785-appaloosa,"While there's nothing particularly original about the plot, the characters and the way they interact with each other are strikingly played",Appaloosa,"['Action & Adventure', 'Western']"
m/10008785-appaloosa,"Enjoyable, frequently offbeat western with an intriguing script and terrific performances from Harris and Mortensen.",Appaloosa,"['Action & Adventure', 'Western']"
m/10008785-appaloosa,"This, though, is not so much a comedy as a western with the ironic undertones that someone like Hawks would appreciate while telling a story such as Rio Bravo.",Appaloosa,"['Action & Adventure', 'Western']"
m/10008785-appaloosa,The plot is engaging enough but this is best viewed as a buddy movie with a dynamite duo at its core.,Appaloosa,"['Action & Adventure', 'Western']"
m/10008785-appaloosa,"Too much romance makes the movie sag near the end and the plot could have gone in a more interesting direction. But if you are wild about Westerns, saddle up for Appaloosa.",Appaloosa,"['Action & Adventure', 'Western']"
m/10008785-appaloosa,"In all, it's a magnificent ride and certainly one of the finest films of the year.",Appaloosa,"['Action & Adventure', 'Western']"
m/10008785-appaloosa,"If a western is going to be this slow, it needs to have a lot more tension, and deeper meaning, than this one.",Appaloosa,"['Action & Adventure', 'Western']"
m/10008785-appaloosa,"A classics-steeped western that rams home tradition over reinvention, Appaloosa kicks it hard as a buddy pic on horseback. Harris and Mortensen's study in laid-back companionship is the principal pleasure, leaving Zellweger mired in role that does her and",Appaloosa,"['Action & Adventure', 'Western']"
m/10008785-appaloosa,"As comfortable as an old saddle and as sharp as an Apache arrow, this a Western for the modern era.",Appaloosa,"['Action & Adventure', 'Western']"
m/10008785-appaloosa,"A pity that Harris's homage to westerns should be compromised so intrusively. For most of its length, in terms of its themes, pacing and visual sweep, it's a treat.",Appaloosa,"['Action & Adventure', 'Western']"
m/10008785-appaloosa,"Photographed handsomely with wide-angled majesty, the film does precious little myth-making, though Harris subtly twists some of the genre's conventions.",Appaloosa,"['Action & Adventure', 'Western']"
m/10008785-appaloosa,"This is no revisionist western designed to shock life into an unfashionable genre, rather a film that respects the conventions of the traditional western.",Appaloosa,"['Action & Adventure', 'Western']"
m/10008785-appaloosa,"A western that moseys along in amiable style, largely thanks to the chemistry between Harris and Mortensen.",Appaloosa,"['Action & Adventure', 'Western']"
m/10008785-appaloosa,"These are horse-opera fundamentals; having given them short shrift, the film just shuffles down its lonesome trail into the horizon and out of your memory.",Appaloosa,"['Action & Adventure', 'Western']"
m/10008785-appaloosa,"These days, westerns are a dying breed, uncommonly found in multiplexes. Appaloosa is the latest reason why.",Appaloosa,"['Action & Adventure', 'Western']"
m/10008785-appaloosa,"Ed Harris, working from a Robert Parker novel, has crafted a meticulously detailed, newfangled old-fashioned morality tale of hard men who go soft when a woman comes between them.",Appaloosa,"['Action & Adventure', 'Western']"
m/10008785-appaloosa,This is an honest tale of the camaraderie between a pair of lawmen simply trying to do a job.,Appaloosa,"['Action & Adventure', 'Western']"
m/10008785-appaloosa,"Actor turned filmmaker Ed Harris wants to go back to the days of simple sagebrush storytelling, and with one major exception, everything he does...is nothing short of brilliant.",Appaloosa,"['Action & Adventure', 'Western']"
m/10008785-appaloosa,Harris proves that there is still some life yet in a genre that has essentially been left for dead for nearly four decades at this point.,Appaloosa,"['Action & Adventure', 'Western']"
m/10008785-appaloosa,"""Appaloosa"" doesnt re-invent the Western, and thank goodness for that.",Appaloosa,"['Action & Adventure', 'Western']"
m/10008785-appaloosa,"...one heck of a western, one that will join the ranks of ""Unforgiven"" and ""3:10 to Yuma"" as modern classics.",Appaloosa,"['Action & Adventure', 'Western']"
m/10008785-appaloosa,"... a well-told, thoroughly enjoyable and refreshingly direct buddy Western, and that's more than enough.",Appaloosa,"['Action & Adventure', 'Western']"
m/10008785-appaloosa,There is plenty of plot but not enough story. And the film unfolds in short scenes strung together that beg to be expanded into more detailed examinations of behavior.,Appaloosa,"['Action & Adventure', 'Western']"
m/10008785-appaloosa,"[Harris's] performance as the usually quiet but quick-to-action gunman is terrific, and he's smart enough to leave much of the narration duties and such to the soft-spoken Mortensen.",Appaloosa,"['Action & Adventure', 'Western']"
m/10008785-appaloosa,"Appaloosa is an archetypal western with touches of the modern buddy comedy. Though it falls short of these classics, it is a little bit Destry Rides Again and a little bit more Butch Cassidy and the Sundance Kid.",Appaloosa,"['Action & Adventure', 'Western']"
m/10008785-appaloosa,"Vastly entertaining in the old-fashioned ways: fun story, fun characters, fun everything.",Appaloosa,"['Action & Adventure', 'Western']"
m/10008785-appaloosa,What is seductive about Appaloosa is its easygoing rhythm.,Appaloosa,"['Action & Adventure', 'Western']"
m/10008785-appaloosa,"Ambition is a great quality in a filmmaker, especially when it's realized. Yet there is something to be said for just telling a story, and with Appaloosa, Harris does a fine job of it.",Appaloosa,"['Action & Adventure', 'Western']"
