rotten_tomatoes_link,review_content,movie_title,genre_list
m/1023739-winchester_73,"Mann's first film with James Stewart, with whom he was to make a series of classic Westerns, this offers the clearest example of Mann's use of the revenge plot.",Winchester '73,"['Classics', 'Western']"
m/1023739-winchester_73,"The first collaboration between director Mann and actor Stewart, a team that would create a series of superior westerns that added a new, psychological dimension to the genre.",Winchester '73,"['Classics', 'Western']"
m/1023739-winchester_73,"Stewart brings real flavor and appeal to the role of Lin, in a lean, concentrated portrayal.",Winchester '73,"['Classics', 'Western']"
m/1023739-winchester_73,Every bit the classic its reputation suggests.,Winchester '73,"['Classics', 'Western']"
m/1023739-winchester_73,The ruthless scraping of the Western's heroic veneer is Anthony Mann's stroke of genius,Winchester '73,"['Classics', 'Western']"
m/1023739-winchester_73,"Winchester '73 is simply one of the finest Westerns ever made, in a class with the best of Ford and Hawks.",Winchester '73,"['Classics', 'Western']"
m/1023739-winchester_73,Atmospheric Western with an unusual look at Dodge City and Wyatt Earp.,Winchester '73,"['Classics', 'Western']"
m/1023739-winchester_73,"With such a strong cast, the film almost turns into an ensemble film instead of a star vehicle for Stewart in his first of many collaborations with Mann.",Winchester '73,"['Classics', 'Western']"
m/1023739-winchester_73,"Strikingly photographed in black & white, the film is directed with an eye to realistic detail, an ear for the script's frequently natural dialogue and a knack for building suspense.",Winchester '73,"['Classics', 'Western']"
m/1023739-winchester_73,"This is a fine, mature work: adult, intelligent and moral, creating a laconic new persona for the admirable Stewart.",Winchester '73,"['Classics', 'Western']"
m/1023739-winchester_73,"Winchester '73 changed the way cinema audiences saw the Western, because it featured a more complex idea of the noble hero of the west -- a man plagued by personal problems and violent impulses.",Winchester '73,"['Classics', 'Western']"
m/1023739-winchester_73,"It's a lively Western with some humor, lots of action and few noticeably dull moments.",Winchester '73,"['Classics', 'Western']"
m/1023739-winchester_73,"The film is pretty much a standard Western. It is also, like most of its kind, a pleasant means of passing an hour and a half in air-conditioned comfort.",Winchester '73,"['Classics', 'Western']"
m/1023739-winchester_73,I enjoyed every minute.,Winchester '73,"['Classics', 'Western']"
m/1023739-winchester_73,A good western.,Winchester '73,"['Classics', 'Western']"
m/1023739-winchester_73,"Yes -- it's another frontier saga type, but the acting of James Stewart, Shelly Winters, Dan Duryea, and Stephen McNally lift it from the rut.",Winchester '73,"['Classics', 'Western']"
m/1023739-winchester_73,"It manages to encompass the entire spectrum of Western tropes in a brief span of time, which is itself an entertaining endeavor by director Anthony Mann.",Winchester '73,"['Classics', 'Western']"
m/1041055-ned_kelly,This film is worth seeing for those who want to see what Mick Jagger looks like when sporting an Abe Lincoln beard.,"Ned Kelly (Ned Kelly, Outlaw)","['Action & Adventure', 'Western']"
m/1041055-ned_kelly,a debacle,"Ned Kelly (Ned Kelly, Outlaw)","['Action & Adventure', 'Western']"
m/1041055-ned_kelly,"Curiously though, as it so often does, the rare convergence of everything gone wrong makes for pretty compulsive viewing.","Ned Kelly (Ned Kelly, Outlaw)","['Action & Adventure', 'Western']"
m/1041055-ned_kelly,Colorful vignettes... only touch on but do not fully reveal the drama or the history behind the events.,"Ned Kelly (Ned Kelly, Outlaw)","['Action & Adventure', 'Western']"
m/1041055-ned_kelly,Richardson's bushranger biopic merely applies a simplistic gloss to the 'outlaw' image already projected onto Jagger... and his role as the legendary Australian anti-hero emerges as little more than an uncomfortable displacement of his tabloid notoriety.,"Ned Kelly (Ned Kelly, Outlaw)","['Action & Adventure', 'Western']"
m/1041055-ned_kelly,"Clunky, slow Mick Jagger starrer directed by Tony Richardson.","Ned Kelly (Ned Kelly, Outlaw)","['Action & Adventure', 'Western']"
m/1041055-ned_kelly,It is a film to which one applies the damning word 'interesting'.,"Ned Kelly (Ned Kelly, Outlaw)","['Action & Adventure', 'Western']"
m/1041055-ned_kelly,"The blame has to be laid at the door of director Tony Richardson, whose handling sometimes obscures the message and buries the drama.","Ned Kelly (Ned Kelly, Outlaw)","['Action & Adventure', 'Western']"
m/1041911-unforgiven,"Enjoy it for the handsome wide-screen vistas, the interplay of the actors, the classical sweep of its story line. Just don't expect the new, soul-searching Eastwood to be any more dramatically convincing than the old.",Unforgiven,"['Drama', 'Western']"
m/1041911-unforgiven,"By now ... Eastwood has little more than a paint-by-numbers approach to acting. As a result, we relate to Munny more as a compendium of Eastwood's earlier characters.",Unforgiven,"['Drama', 'Western']"
m/1041911-unforgiven,"Searing and somber, Unforgiven shatters every myth of the Wild West that Hollywood has ever thrown at us, and does it will an unmistakable ring of truth.",Unforgiven,"['Drama', 'Western']"
m/1041911-unforgiven,Gene Hackman and Clint Eastwood face off in one of the best westerns ever made -- make that the best western ever made -- produced some 50 years after the prime of the western era.,Unforgiven,"['Drama', 'Western']"
m/1041911-unforgiven,"Aside from being one of the highlights of Eastwood's long career, this film unquestionably offers one of his top directing efforts.",Unforgiven,"['Drama', 'Western']"
m/1041911-unforgiven,This is the best work Eastwood has done as a director since The Outlaw Josey Wales 16 years ago.,Unforgiven,"['Drama', 'Western']"
m/1041911-unforgiven,"Unforgiven (1992) is producer/director/star Clint Eastwood's own tribute to his legendary legacy in Sergio Leone's low-budget 'spaghetti' westerns,",Unforgiven,"['Drama', 'Western']"
m/1041911-unforgiven,"Great acting, realistic sets, and taut direction by Eastwood.",Unforgiven,"['Drama', 'Western']"
m/1041911-unforgiven,In the '90s it stands alone as a great achievement in American filmmaking.,Unforgiven,"['Drama', 'Western']"
m/1041911-unforgiven,"This film shows a surprising bitterness about the myths of the Old West. Yet where they are debunked, the film rings true.",Unforgiven,"['Drama', 'Western']"
m/1041911-unforgiven,"Jumps adroitly between the macho and anti-macho, the romantic and anti-romantic.",Unforgiven,"['Drama', 'Western']"
m/1041911-unforgiven,"The film is a masterpiece, a stunning and awe-inspiring statement.",Unforgiven,"['Drama', 'Western']"
m/1041911-unforgiven,"In three decades of climbing into the saddle, Eastwood has never ridden so tall.",Unforgiven,"['Drama', 'Western']"
m/1041911-unforgiven,"Eastwood has cast his lot with one of the finest screenplays to have come along in many years, and the result stands him, unembarrassed, in the company of greatness.",Unforgiven,"['Drama', 'Western']"
m/1041911-unforgiven,Clint Eastwood teve bons professores.,Unforgiven,"['Drama', 'Western']"
m/1041911-unforgiven,A film that can stand proudly in the rarefied company of the very best westerns ever made.,Unforgiven,"['Drama', 'Western']"
m/1041911-unforgiven,"That implacable moral balance, in which good eventually silences evil, is at the heart of the Western, and Eastwood is not shy about saying so.",Unforgiven,"['Drama', 'Western']"
m/1041911-unforgiven,Vivid morality tale for adults about the difficulty we all have overcoming deeply ingrained,Unforgiven,"['Drama', 'Western']"
m/1041911-unforgiven,"...for all its attempts at debunking the conventional Hollywood Western, 'Unforgiven' remains an orthodox example of the breed.",Unforgiven,"['Drama', 'Western']"
m/1041911-unforgiven,"A brilliant Western, unlike any you've ever seen.",Unforgiven,"['Drama', 'Western']"
m/1041911-unforgiven,[One] of the best movies of the nineties.,Unforgiven,"['Drama', 'Western']"
m/1041911-unforgiven,"Along with Altman's McCabe and Mrs. Miller, as authentic a depiction of a Wild West town as you are likely to find.",Unforgiven,"['Drama', 'Western']"
m/1041911-unforgiven,"Dark, brooding, and remorseless. We may never see its like again.",Unforgiven,"['Drama', 'Western']"
m/1041911-unforgiven,"He's old, he's pissed, and he's gonna kill everyone. Dude, it's Clint. Enough said.",Unforgiven,"['Drama', 'Western']"
m/1041911-unforgiven,The action scenes have an almost documentary realism about them. Up until the final gun battle the film seems like a very authentic slice of the Old West.,Unforgiven,"['Drama', 'Western']"
m/1041911-unforgiven,Unforgiven is a most entertaining western that pays homage to the great tradition of movie westerns while surreptitiously expressing a certain amount of skepticism.,Unforgiven,"['Drama', 'Western']"
m/1041911-unforgiven,"One of Eastwood's finest outings to date, an elegiac western that ironically undermines the conventions of the genre, only to deliver a finale as legendary as the shootout at the O.K. Corral.",Unforgiven,"['Drama', 'Western']"
m/1041911-unforgiven,"Hollywood's great revisionist western, well deserving of its Best Picture Oscar",Unforgiven,"['Drama', 'Western']"
m/1041911-unforgiven,In Clint's vision of the Old West all parties are tainted by violence and the need for revenge.,Unforgiven,"['Drama', 'Western']"
m/1041911-unforgiven,One of the greatest Westerns made.,Unforgiven,"['Drama', 'Western']"
m/1041911-unforgiven,"A near-great Western, weakened only by overt revisionism.",Unforgiven,"['Drama', 'Western']"
m/1041911-unforgiven,Revisionist Eastwood western is terrific on all counts.,Unforgiven,"['Drama', 'Western']"
m/1041911-unforgiven,"Gritty, brooding and hardhitting.",Unforgiven,"['Drama', 'Western']"
m/1041911-unforgiven,"Conveys the power of the Western genre's myths ... as well as the ugly, unromantic realities that lurk behind them.",Unforgiven,"['Drama', 'Western']"
m/1041911-unforgiven,"A complex and haunting Old-West morality tale...Thanks Clint, for once again making my day.",Unforgiven,"['Drama', 'Western']"
m/1041911-unforgiven,"In this dark, timeless terrain, the film achieves a magnificent intensity.",Unforgiven,"['Drama', 'Western']"
m/1041911-unforgiven,"Dark and somber in thematics and visuals, this Western is a personal work for Eastwood, in which he desconstructs his own mythic violent image, one that made him a star in the 1960s.",Unforgiven,"['Drama', 'Western']"
m/1041911-unforgiven,There's not much dramatic urgency apart from the revisionist context.,Unforgiven,"['Drama', 'Western']"
m/1041911-unforgiven,A rigorous deconstruction of both fictitious violence and Eastwood's own career as a trigger-happy 'hero.',Unforgiven,"['Drama', 'Western']"
m/1041911-unforgiven,Arguably the greatest western since Sam Peckinpah hung up his stirrups.,Unforgiven,"['Drama', 'Western']"
m/1041911-unforgiven,"Ironically, the ultimate Western of all was made decades after its hayday. This is captivating for all, not just fans of the genre.",Unforgiven,"['Drama', 'Western']"
m/1041911-unforgiven,A classic Western for the ages.,Unforgiven,"['Drama', 'Western']"
m/1041911-unforgiven,"One of Unforgiven's assets is the way it overturns conventions, taking the man who is typically the hero and making him the villain, while transforming the traditional bad guy into a sympathetic protagonist.",Unforgiven,"['Drama', 'Western']"
m/1041911-unforgiven,"Eastwood's meditation on age, repute, courage, heroism -- on all those burdens he has been carrying with such good grace for decades.",Unforgiven,"['Drama', 'Western']"
m/1041911-unforgiven,"Eastwood's disturbingly human in Unforgiven, a stunning, dark Western that may stand as the actor/director's summation of the form.",Unforgiven,"['Drama', 'Western']"
m/1041911-unforgiven,Unforgiven began Clint Eastwood's current apology tour for his cinematic violence.,Unforgiven,"['Drama', 'Western']"
m/1041911-unforgiven,"Individual scenes work, but the movie seems overstuffed and halting.",Unforgiven,"['Drama', 'Western']"
m/1041911-unforgiven,"Eastwood's best film -- a compelling study of the shame and guilt that attends violence, of the rule of the mighty over the weak and of courage and cowardice.",Unforgiven,"['Drama', 'Western']"
m/1041911-unforgiven,The film at its heart is the first in a line of revisionist superhero movies.,Unforgiven,"['Drama', 'Western']"
m/1041911-unforgiven,"The great Orson Welles once stated that Clint Eastwood was the most underrated filmmaker in America, and the sobering footnote is that he passed away in 1985, well before Eastwood began to be taken seriously as an artist by most critics and moviegoers.",Unforgiven,"['Drama', 'Western']"
m/1041911-unforgiven,One of the absolute masterpieces of American cinema in the 1990s.,Unforgiven,"['Drama', 'Western']"
m/1041911-unforgiven,"It's a somber feature, but one of extraordinary character development, bundled into a compelling story of men facing their sins in a most brutal, pitiless manner.",Unforgiven,"['Drama', 'Western']"
m/1041911-unforgiven,Unforgiven exposes the true price behind the way the West was won.,Unforgiven,"['Drama', 'Western']"
m/1041911-unforgiven,"Clint Eastwood's westerns are distinctive, and that Unforgiven, as the most fully realized, is the most distinctive of all.",Unforgiven,"['Drama', 'Western']"
m/1041911-unforgiven,"This is the finest set of performances ever to grace a Clint Eastwood movie, and this time Eastwood even does a good job directing Eastwood. Every bullet in this movie matters.",Unforgiven,"['Drama', 'Western']"
m/1041911-unforgiven,"This dark, melancholic film is a reminder-never more necessary than now-of what the American cinema is capable of, in the way of expressing a mature, morally complex and challenging view of the world.",Unforgiven,"['Drama', 'Western']"
m/1041911-unforgiven,"Realistic and thoughtful, Unforgiven has the pictorial sweep we've come to expect from the genre and the intelligence too long missing from it.",Unforgiven,"['Drama', 'Western']"
m/1041911-unforgiven,"This isn't just a great Western. It's a great movie, no matter what the genre.",Unforgiven,"['Drama', 'Western']"
m/1041911-unforgiven,"[Unforgiven] belongs to a tradition that includes such giants of the genre as Mann, Boetticher, Peckinpah and Hawks.",Unforgiven,"['Drama', 'Western']"
m/1041911-unforgiven,There is unlikely to be a better movie from the States or anywhere else this year.,Unforgiven,"['Drama', 'Western']"
m/1041911-unforgiven,It shouldn't be missed by anyone with a taste for Eastwood's typically slanted morality. It's the actor/director's best movie -- and the best Western by anybody -- in over 20 years.,Unforgiven,"['Drama', 'Western']"
m/1041911-unforgiven,High Noon it isn't; it's more like the darkest midnight of the American soul.,Unforgiven,"['Drama', 'Western']"
m/1041911-unforgiven,"Unforgiven ain't nuthin' new, y'unnerstan', but it's a good, old-fashioned western-type pitcher with plenty o' rootin' tootin' action 'n' big ol' horses 'n' 10-gallon hats 'n' sech.",Unforgiven,"['Drama', 'Western']"
m/1041911-unforgiven,"While Eastwood dedicates the film to Sergio Leone and Don Siegel, his early directors, he doesn't seem to have learned all that much from them.",Unforgiven,"['Drama', 'Western']"
m/1041911-unforgiven,"Eastwood deliberately upends the conventions of the western, subverting his own image in the process.",Unforgiven,"['Drama', 'Western']"
m/1041911-unforgiven,"That's always been Eastwood's appeal -- the imperial authority that he projects on the screen. In Unforgiven, he uses that authority to deliver an anti-violence message that is truly powerful, never shrill and preachy.",Unforgiven,"['Drama', 'Western']"
m/1041911-unforgiven,The Western is back. With a vengeance. Saddle up or get out of the way.,Unforgiven,"['Drama', 'Western']"
m/1041911-unforgiven,"Unforgiven plays out its drama with enough old-fashioned sobriety to lend the proceedings a classical air... It also incorporates enough latter-day cynicism, though, to comply with contemporary Hollywood fashion.",Unforgiven,"['Drama', 'Western']"
m/1041911-unforgiven,"This is, quite simply, one of the finest films ever made in the genre.",Unforgiven,"['Drama', 'Western']"
m/1041911-unforgiven,"casts an unforgiving eye, from both insider and outsider perspectives, on the brutalities and hypocrisies of an 'enlightened' nation's Restoration period.",Unforgiven,"['Drama', 'Western']"
m/1041911-unforgiven,"Eastwoods' best, most personal work as both an actor and director can be found in this dark and sombre western classic.",Unforgiven,"['Drama', 'Western']"
m/1041911-unforgiven,"...perhaps the best argument for Clint Eastwood as a savvier, craftier and more complicated filmmaker than the one many consider him to be.",Unforgiven,"['Drama', 'Western']"
m/1041911-unforgiven,"""Unforgiven"" is a high-caliber movie, a gripping and haunting work of art that should finally establish Eastwood as one of America's best directors.",Unforgiven,"['Drama', 'Western']"
m/1041911-unforgiven,"A sombre, insightful, genre-reinventing western, directed by a filmmaker acutely aware of the western's history, its limitations and the dubious truths of its legends.",Unforgiven,"['Drama', 'Western']"
m/1041911-unforgiven,"Clint Eastwood's 1992 western Unforgiven earned the director his first Oscars, for Best Picture and Best Director.",Unforgiven,"['Drama', 'Western']"
m/1041911-unforgiven,"Unforgiven brought the revisionist revenge film into the 1990s and, by extension, the 21st century.",Unforgiven,"['Drama', 'Western']"
m/1041911-unforgiven,"Unforgiven is a stark western in slow motion, obsessed with reflection, not action.",Unforgiven,"['Drama', 'Western']"
m/1041911-unforgiven,"While not a pretty picture... Unforgiven is a magnificently realized work. In addition to Eastwood's fine, rough performance, Hackman and Freeman stand out.",Unforgiven,"['Drama', 'Western']"
m/1041911-unforgiven,That's the truly subversive act at the heart of 'Unforgiven': Clint Eastwood is puncturing a Western mythology he helped create.,Unforgiven,"['Drama', 'Western']"
m/1041911-unforgiven,"No thrill comes cheap in Unforgiven. The West that it shows is Wild all right, but more like a dog than a party. That doesn't mean we can't enjoy being dragged along for the ride; the rougher the better, in fact, as every action zings with ricochets.",Unforgiven,"['Drama', 'Western']"
m/1041911-unforgiven,"It's not a movie for kids, but it's a fine movie for any adult who doesn't mind thinking a little after the hot lead has flown.",Unforgiven,"['Drama', 'Western']"
m/1041911-unforgiven,...one of the greatest westerns in the history of cinema. [Full Review in Spanish],Unforgiven,"['Drama', 'Western']"
m/1041911-unforgiven,"Impressive, laconic, revisionist western.",Unforgiven,"['Drama', 'Western']"
m/1041911-unforgiven,[Clint] Eastwood reinvents the western. [Full Review in Spanish],Unforgiven,"['Drama', 'Western']"
m/1041911-unforgiven,Unforgiven gives us something to think about -- and something to answer for -- and Eastwood was just the man to make it.,Unforgiven,"['Drama', 'Western']"
m/1041911-unforgiven,The film has a kind of wise knowingness which may well mislead some people into thinking that its main aim is to debunk the western.,Unforgiven,"['Drama', 'Western']"
m/1041911-unforgiven,"With its unflinching depictions of brutalities, Eastwood's new western calls to mind the work of Sam Peckinpah. But Eastwood's cadences are slow, his antiheros rueful, his atmosphere murky and chilling.",Unforgiven,"['Drama', 'Western']"
m/1041911-unforgiven,Clint Eastwood's brilliant and harrowing Unforgiven packs all the punch of a good Western without indulging in the plot cliches and moral certitudes so often inherent in the genre.,Unforgiven,"['Drama', 'Western']"
m/1041911-unforgiven,Apart from giving the Western genre a powerful boost Unforgiven does wonders for Eastwood's own profile.,Unforgiven,"['Drama', 'Western']"
m/1041911-unforgiven,[Eastwood's] best Western -- the most distinguised film he has appeared in and directed -- since The Outlaw Josey Wales.,Unforgiven,"['Drama', 'Western']"
m/1041911-unforgiven,"Eloquent and expansive, Unforgiven is arguably the best film of Eastwood's career-a movie that could well serve as the last word on the western.",Unforgiven,"['Drama', 'Western']"
m/1041911-unforgiven,"Arguably the last of the great movie westerns... The real star of the show here is Gene Hackman, playing the psychotic town sheriff who stands in the way of the trio's bounty.",Unforgiven,"['Drama', 'Western']"
m/1041911-unforgiven,Unforgiven thus rejects Eastwood's previous filmography and the patriotic speeches of many other filmmakers involved with the western. [Full Review in Spanish],Unforgiven,"['Drama', 'Western']"
m/1041911-unforgiven,It's an undeniable classic for reasons I can't acknowledge. Its last minutes are glorious but Eastwood's western epic has lost some substance. [Full review in Spanish].,Unforgiven,"['Drama', 'Western']"
m/1041911-unforgiven,"An astoundingly powerful tale of a strangely anti-Old West, multilayered outlaw, this film is one of the finest revisionist epics ever brought to the big screen.",Unforgiven,"['Drama', 'Western']"
m/1043958-posse,"An overdirected, overphotographed, overdone movie that is so distracted by its hectic, relentless style that the story line is rendered almost incoherent.",Posse,"['Action & Adventure', 'Art House & International', 'Western']"
m/1043958-posse,A stylized mess.,Posse,"['Action & Adventure', 'Art House & International', 'Western']"
m/1043958-posse,"Some interesting race-related points are raised, but Van Peebles disappoints by focusing instead on the standard elements of the genre.",Posse,"['Action & Adventure', 'Art House & International', 'Western']"
m/1043958-posse,Rousing entertainment directed by Van Peebles with a rare sense of purpose and mischief.,Posse,"['Action & Adventure', 'Art House & International', 'Western']"
m/1043958-posse,"Decent western, some good shootouts and action scenes.",Posse,"['Action & Adventure', 'Art House & International', 'Western']"
m/1043958-posse,Western as vanity project,Posse,"['Action & Adventure', 'Art House & International', 'Western']"
m/1043958-posse,Van Peebles' second indie is a rousing hip-hop Western that flaunts lurid visuals at the expense of coherent narrative and sharp characterixation; a trivial and messy exercise in style.,Posse,"['Action & Adventure', 'Art House & International', 'Western']"
m/1043958-posse,"So-so oater distinguished by Van Peebles' direction, starring.",Posse,"['Action & Adventure', 'Art House & International', 'Western']"
m/1043958-posse,Part of the problem seems to have been that Van Peebles had too much to say.,Posse,"['Action & Adventure', 'Art House & International', 'Western']"
m/1043958-posse,"''Posse,'' which could have been a moving and gripping tribute to black Western heroes - and a testament against bigotry and injustice - ends up with laughs in all the wrong places.",Posse,"['Action & Adventure', 'Art House & International', 'Western']"
m/1046060-high_noon,"Not a frame is wasted in this taut, superbly directed, masterfully acted film.",High Noon,"['Mystery & Suspense', 'Western']"
m/1046060-high_noon,"Flaws don't negate the strong impact this film would have on the viewer, the impact that inspired many future filmmakers and made High Noon one of the most important pieces of American film legacy.",High Noon,"['Mystery & Suspense', 'Western']"
m/1046060-high_noon,High Noon (1952) is possibly the all-time best Western film ever made - a successful box-office production by Stanley Kramer,High Noon,"['Mystery & Suspense', 'Western']"
m/1046060-high_noon,Arguably THE classic western.,High Noon,"['Mystery & Suspense', 'Western']"
m/1046060-high_noon,The film works remarkably well as a simple but powerful parable.,High Noon,"['Mystery & Suspense', 'Western']"
m/1046060-high_noon,"The Western may be one of the few truly American art forms, and High Noon shows exactly how much potential it can embrace.",High Noon,"['Mystery & Suspense', 'Western']"
m/1046060-high_noon,"A film about what it means to be a man that manages to avoid the musk of machismo, High Noon is truly a film that improves with each and every viewing.",High Noon,"['Mystery & Suspense', 'Western']"
m/1046060-high_noon,"Just a good guy, a bad guy, and a clean-cut ending that leaves you shrugging the whole thing off.",High Noon,"['Mystery & Suspense', 'Western']"
m/1046060-high_noon,"This outstanding drama ticks by in real time, only 84 tense minutes long.",High Noon,"['Mystery & Suspense', 'Western']"
m/1046060-high_noon,O primeiro filme a ensinar que um faroeste poderia ter densidade dramtica sem perder suas prprias caractersticas.,High Noon,"['Mystery & Suspense', 'Western']"
m/1046060-high_noon,One of the best westerns ever made. Had me on the edge of my seat the entire time!,High Noon,"['Mystery & Suspense', 'Western']"
m/1046060-high_noon,"There's no reason to upgrade if you own the previous DVD release. ... [But] if you don't have this movie, you should pick up a copy. It's a classic.",High Noon,"['Mystery & Suspense', 'Western']"
m/1046060-high_noon,"Meaningful in its implications, as well as loaded with interest and suspense, High Noon is a western to challenge Stagecoach for the all-time championship.",High Noon,"['Mystery & Suspense', 'Western']"
m/1046060-high_noon,"Regarded as '50s melodrama, it's nearly perfect.",High Noon,"['Mystery & Suspense', 'Western']"
