rotten_tomatoes_link,movie_title,critic_name,top_critic,tomatometer_status,review_type,review_year,review_content,gender,genre_list,sentiment_scores,compound_score
m/bedtime_stories,Bedtime Stories,James Rocchi,False,Rotten,Rotten,2008,"Bedtime Stories tries to be charming and whimsical, but while charm and whimsy, like love, can be helped by great sums of money, charm and whimsy, like love, cannot be created by great sums of money.",male,"['Action & Adventure', 'Comedy', 'Kids & Family', 'Science Fiction & Fantasy']","{'neg': 0.031, 'neu': 0.372, 'pos': 0.596, 'compound': 0.9912}",0.9912
m/1197696-fantastic_mr_fox,Fantastic Mr. Fox,James Rocchi,True,Certified-Fresh,Fresh,2009,"Cool, clever, crafty and delirious amounts of fun, ""Fantastic Mr. Fox"" is full of brilliant visual invention and silly slapstick while also having hip humor and sly smarts -- it's pure movie-going joy and a rare kind of pleasure.",male,"['Action & Adventure', 'Animation', 'Comedy', 'Kids & Family']","{'neg': 0.0, 'neu': 0.491, 'pos': 0.509, 'compound': 0.9799}",0.9799
m/akeelah_and_the_bee,Akeelah and the Bee,Willie Waffle,False,Certified-Fresh,Fresh,2006,"heartwarming feel good story about an underdog trying to overcome the odds and achieve fantastic victory, while also winning over an entire community inspired by her bravery. Yep, that sounds pretty good to me, too.",mostly_male,"['Drama', 'Kids & Family']","{'neg': 0.0, 'neu': 0.484, 'pos': 0.516, 'compound': 0.9792}",0.9792
m/cars_3,Cars 3,Richard Roeper,True,Fresh,Fresh,2017,"Cars 3 is a lovely, clever and entertaining generational tale with tons of heart, a simple and effective storyline, wonderful candy-colored visuals and winning voice work from the talented cast of returning regulars and welcome newcomers.",male,"['Animation', 'Comedy', 'Kids & Family']","{'neg': 0.0, 'neu': 0.488, 'pos': 0.512, 'compound': 0.9781}",0.9781
m/aladdin,Aladdin,Charlie Ridgely,False,Rotten,Fresh,2019,"Aladdin is certainly less than the sum of its parts, but the parts are all so fantastic that it doesn't always matter. This is a fun adventure and a great time. Not exactly a whole new world, but certainly one that I don't mind journeying to again.",mostly_male,"['Action & Adventure', 'Kids & Family', 'Science Fiction & Fantasy']","{'neg': 0.018, 'neu': 0.586, 'pos': 0.395, 'compound': 0.978}",0.978
m/big_hero_6,Big Hero 6,Danielle Riendeau,False,Certified-Fresh,Fresh,2017,"Big Hero 6 is clever, sweet and intensely likable, much like its band of heroes. I walked out of the theater happy and energized, and if the young families in my screening were any indication, just like a kid.",female,"['Animation', 'Kids & Family']","{'neg': 0.0, 'neu': 0.524, 'pos': 0.476, 'compound': 0.9762}",0.9762
m/beauty_and_the_beast_1991,Beauty and the Beast,Diva Velez,False,Certified-Fresh,Fresh,2012,"One of the brightest jewels in Disney's crown, Beauty and the Beast's 3D reissue takes nothing away and makes the film's brilliance even easier to appreciate; the movie is more beautiful and timeless than it ever was.",female,"['Animation', 'Drama', 'Kids & Family', 'Musical & Performing Arts', 'Science Fiction & Fantasy', 'Romance']","{'neg': 0.0, 'neu': 0.552, 'pos': 0.448, 'compound': 0.9761}",0.9761
m/charlottes_web,Charlotte's Web,MaryAnn Johanson,False,Certified-Fresh,Fresh,2006,"Happy happy, joy joy... This is a wonder of gentle humor, tender sentiment, and uplifting philosophy about the joys of friendship, the marvels of nature, the circle of life.",unknown,"['Animation', 'Drama', 'Kids & Family']","{'neg': 0.0, 'neu': 0.442, 'pos': 0.558, 'compound': 0.9758}",0.9758
m/1142872-sky_high,Sky High,James Rocchi,False,Fresh,Fresh,2005,"Disney's kid flick about a superhero high school isn't groundbreaking, but it is great family fun with a strong cast and a nice sense of entertainment.",male,"['Action & Adventure', 'Comedy', 'Kids & Family', 'Science Fiction & Fantasy']","{'neg': 0.0, 'neu': 0.451, 'pos': 0.549, 'compound': 0.9749}",0.9749
m/charlottes_web,Charlotte's Web,Carla Meyer,False,Certified-Fresh,Fresh,2006,"Charlotte's Web gives E.B. White's classic tale a spiffy cinematic update but leaves its core values intact. Visually accomplished and heartfelt, this G-rated gem is radiant, terrific and really some film.",female,"['Animation', 'Drama', 'Kids & Family']","{'neg': 0.0, 'neu': 0.514, 'pos': 0.486, 'compound': 0.974}",0.974
m/1019187-sleeping_beauty,Sleeping Beauty,Jeff Beck,False,Certified-Fresh,Fresh,2014,"Sleeping Beauty is a masterpiece that looks and sounds better than ever on Blu-ray, and with an outstanding selection of fascinating special features, this is a release that is easily labeled a must-own.",male,"['Animation', 'Classics', 'Kids & Family', 'Science Fiction & Fantasy']","{'neg': 0.0, 'neu': 0.496, 'pos': 0.504, 'compound': 0.9732}",0.9732
m/10009063-perfect_holiday,The Perfect Holiday,Connie Ogle,True,Rotten,Fresh,2007,The messages here are what you'd expect: Love your family. Don't be selfish. Don't tell lies. Have a happy holiday. Christmas doesn't have to be perfect to entertain you. Just like this movie.,mostly_female,"['Kids & Family', 'Romance']","{'neg': 0.0, 'neu': 0.5, 'pos': 0.5, 'compound': 0.9719}",0.9719
m/charlie_brown_thanksgiving,A Charlie Brown Thanksgiving,Michael Walsh,False,Fresh,Fresh,2018,"The Great Pumpkin may be infinitely memorable, but the Thanksgiving special has a better story and themes more meaningful for the holiday it is celebrating.",male,"['Animation', 'Drama', 'Kids & Family']","{'neg': 0.0, 'neu': 0.451, 'pos': 0.549, 'compound': 0.9717}",0.9717
m/big_hero_6,Big Hero 6,Debbie Lynn Elias,False,Certified-Fresh,Fresh,2019,"Soaring with action, adventure, charm, heart, soul and a whole lot of fun - not to mention Baymax, one of the most adorable heroes ever... Big Hero 6 is the new big screen hero!",female,"['Animation', 'Kids & Family']","{'neg': 0.0, 'neu': 0.512, 'pos': 0.488, 'compound': 0.9715}",0.9715
m/aladdin,Aladdin,Ruth Maramis,False,Rotten,Fresh,2019,"I went in hoping to be pleasantly surprised and I was! It has its problems, but overall it's a fun affair thanks to its charming leads. Naomi Scott is a revelation with a bold, defiant new song fit for an empowered princess.",female,"['Action & Adventure', 'Kids & Family', 'Science Fiction & Fantasy']","{'neg': 0.074, 'neu': 0.473, 'pos': 0.453, 'compound': 0.9707}",0.9707
m/beauty_and_the_beast_1991,Beauty and the Beast,Steven D. Greydanus,False,Certified-Fresh,Fresh,2010,"At the intersection of great animated films, great filmed stage musicals, and great fairy-tale romances, Disney's Beauty and the Beast stands alone ... the quintessential Disney masterpiece.",male,"['Animation', 'Drama', 'Kids & Family', 'Musical & Performing Arts', 'Science Fiction & Fantasy', 'Romance']","{'neg': 0.045, 'neu': 0.449, 'pos': 0.506, 'compound': 0.9702}",0.9702
m/10009063-perfect_holiday,The Perfect Holiday,Debbie Lynn Elias,False,Rotten,Fresh,2019,"Not just a film that I would I take all of my nephews to see, but one that would bring a smile to my grandmother's face were she here watching it, The Perfect Holiday is the perfect holiday film.",female,"['Kids & Family', 'Romance']","{'neg': 0.0, 'neu': 0.595, 'pos': 0.405, 'compound': 0.97}",0.97
m/astro_boy,Astro Boy (AstroBoy),Diva Velez,False,Rotten,Fresh,2009,"Astro Boy stands on its own as a nifty piece of animated fun, full of good lessons, brisk pacing and humour and sweetness the original anime sometimes lacked. It does Osamu Tezuka's source creation proud.",female,"['Action & Adventure', 'Animation', 'Kids & Family', 'Science Fiction & Fantasy']","{'neg': 0.0, 'neu': 0.507, 'pos': 0.493, 'compound': 0.9694}",0.9694
m/born_free,Born Free,David Parkinson,False,Fresh,Fresh,2015,"Beautifully shot, brilliantly scored by John Barry and sensitively staged by director James Hill, this charming adaptation of Joy Adamson's bestseller is one of the great animal films.",male,"['Action & Adventure', 'Drama', 'Kids & Family']","{'neg': 0.0, 'neu': 0.534, 'pos': 0.466, 'compound': 0.9686}",0.9686
m/arthur_christmas,Arthur Christmas,Olly Richards,False,Certified-Fresh,Fresh,2011,"A great, big joy. Even if you're a bit bah humbug, just delight in the supremely clever Aardman comedy.",mostly_female,"['Animation', 'Comedy', 'Kids & Family']","{'neg': 0.0, 'neu': 0.344, 'pos': 0.656, 'compound': 0.9682}",0.9682
m/1221547-alice_in_wonderland,Alice in Wonderland,Drew McWeeny,False,Rotten,Rotten,2010,"... wrong-headed in pretty much every way it can be, poorly designed, loud, and worst of all, boring. It is a catastrophe as a movie, and as a place marker in the career of Tim Burton, it is a big fat dead end.",male,"['Action & Adventure', 'Kids & Family', 'Science Fiction & Fantasy']","{'neg': 0.289, 'neu': 0.65, 'pos': 0.061, 'compound': -0.9169}",-0.9169
m/10005499-oliver_twist,Oliver Twist,Prairie Miller,False,Fresh,Fresh,2007,The unspoken sense of youthful post-traumatic holocaust syndrome shock and awe in Polanski's Twist is as palpable as the murky stench and appalling human misery of Dickens' chaotic London streets.,unknown,"['Drama', 'Kids & Family']","{'neg': 0.368, 'neu': 0.577, 'pos': 0.055, 'compound': -0.9186}",-0.9186
m/alexander_and_the_terrible_horrible_no_good_very_bad_day,"Alexander and the Terrible, Horrible, No Good, Very Bad Day",Todd McCarthy,True,Fresh,Fresh,2014,"Alexander and the Terrible, Horrible, No Good, Very Bad Day could have been a lot more horrible and no good than it is.",male,['Kids & Family'],"{'neg': 0.488, 'neu': 0.362, 'pos': 0.15, 'compound': -0.9193}",-0.9193
m/cheaper_by_the_dozen,Cheaper by the Dozen,Victoria Alexander,False,Rotten,Rotten,2003,A disgrace. A spineless eunuch of a father allows his children to yell at him and bully him. They destroy a mansion. Their mother must be on heroin.,female,"['Comedy', 'Kids & Family']","{'neg': 0.396, 'neu': 0.604, 'pos': 0.0, 'compound': -0.9201}",-0.9201
m/annie_2012,Annie,Alan Jones,False,Rotten,Rotten,2014,"The 1977 Broadway hit has suffered an overblown 1982 adaptation, a sickly 1999 TV movie and a terrible stage sequel. But the worst hadn't happened to it until this awkwardly updated, misconceived and sloppy remake.",male,"['Drama', 'Kids & Family', 'Musical & Performing Arts']","{'neg': 0.313, 'neu': 0.687, 'pos': 0.0, 'compound': -0.9222}",-0.9222
m/bugs_life,A Bug's Life,Rob Gonsalves,False,Certified-Fresh,Rotten,2007,"Doesn't merit much enthusiasm or indignation; it just skitters across your consciousness, leaving no traces except a vague depression.",male,"['Animation', 'Kids & Family', 'Science Fiction & Fantasy']","{'neg': 0.563, 'neu': 0.437, 'pos': 0.0, 'compound': -0.9251}",-0.9251
m/babe_pig_in_the_city,Babe: Pig in the City,Kevin Maynard,True,Fresh,Rotten,2000,"So distressingly dark, grim, and cynical it's likely to make kids cry!",male,"['Comedy', 'Kids & Family', 'Science Fiction & Fantasy']","{'neg': 0.627, 'neu': 0.373, 'pos': 0.0, 'compound': -0.9253}",-0.9253
m/barnyard,Barnyard,Ed Gonzalez,False,Rotten,Rotten,2006,"This is the most dubious animation since Robert Zemeckis's creepy The Polar Express, only uglier, lazier, and with a more indisputable racist streak.",male,"['Animation', 'Comedy', 'Kids & Family']","{'neg': 0.43, 'neu': 0.57, 'pos': 0.0, 'compound': -0.927}",-0.927
m/cheaper_by_the_dozen,Cheaper by the Dozen,Terry Lawson,True,Rotten,Rotten,2003,"A bad sitcom expanded to 98 excruciatingly unfunny minutes of family chaos, with Martin suffering every possible indignity and stain that can be inflicted on a good-guy daddy.",mostly_male,"['Comedy', 'Kids & Family']","{'neg': 0.392, 'neu': 0.608, 'pos': 0.0, 'compound': -0.9349}",-0.9349
m/cars_2,Cars 2,Kyle Smith,True,Rotten,Rotten,2011,"They said it couldn't be done. But Pixar proved the yaysayers wrong when it made its first bad movie, ""Cars."" Now it has worsted itself with the even more awful ""Cars 2.""",mostly_female,"['Action & Adventure', 'Animation', 'Comedy', 'Kids & Family']","{'neg': 0.315, 'neu': 0.685, 'pos': 0.0, 'compound': -0.9365}",-0.9365
m/a_wrinkle_in_time_2018,A Wrinkle in Time,Dante James,False,Rotten,Rotten,2018,Unfortunately there many other problems that plague this movie. Wonky CGI. Unresolved character arcs. Terrible sound. But the saddest part of all is the wasted potential for a new fantasy/adventure franchise.,male,"['Action & Adventure', 'Drama', 'Kids & Family', 'Science Fiction & Fantasy']","{'neg': 0.381, 'neu': 0.619, 'pos': 0.0, 'compound': -0.9371}",-0.9371
m/bratz_the_movie,Bratz: The Movie,Dustin Putman,False,Rotten,Rotten,2007,There isn't a moment of truth or perception in its miserable 98 minutes; this film's view of high school is so skewed from reality and so insulting in its contempt that it's almost scary to think preteen girls would fall for it.,male,"['Comedy', 'Kids & Family']","{'neg': 0.307, 'neu': 0.693, 'pos': 0.0, 'compound': -0.9431}",-0.9431
m/10009462-g_force,G-Force,Dustin Putman,False,Rotten,Rotten,2009,"The worst Walt Disney Pictures release in a decade. To describe this chaotic, charmless, pop culture-centric product as completely and utterly excruciating is almost too kind a criticism.",male,"['Action & Adventure', 'Comedy', 'Kids & Family', 'Science Fiction & Fantasy']","{'neg': 0.44, 'neu': 0.485, 'pos': 0.076, 'compound': -0.9434}",-0.9434
m/alexander_and_the_terrible_horrible_no_good_very_bad_day,"Alexander and the Terrible, Horrible, No Good, Very Bad Day",Craig Mathieson,False,Fresh,Rotten,2014,Most of the accidents that befall the Cooper clan are annoying or embarrassing and even a car accident is more about cosmetic damage to the vehicle than a passenger actually being harmed.,male,['Kids & Family'],"{'neg': 0.422, 'neu': 0.578, 'pos': 0.0, 'compound': -0.9479}",-0.9479
m/cat_in_the_hat,Dr. Seuss' The Cat in the Hat,Eugene Novikov,False,Rotten,Rotten,2003,"All the signs leading up to this were dire, but honestly, I tried to like it. I was ready to like it. I pumped myself up for it. No go. Disaster, disaster, disaster. Disaster.",male,"['Comedy', 'Kids & Family']","{'neg': 0.441, 'neu': 0.338, 'pos': 0.221, 'compound': -0.9489}",-0.9489
m/1038726-beethoven,Beethoven,Chris Hicks,False,Rotten,Rotten,2000,"The first half of the film is amusing, but when it turns to a distasteful subplot that has an evil veterinarian/scientist stealing pets for nasty experiments, it goes sour.",mostly_male,"['Comedy', 'Kids & Family', 'Special Interest']","{'neg': 0.384, 'neu': 0.573, 'pos': 0.043, 'compound': -0.9535}",-0.9535
m/around_the_world_in_80_days,Around the World in 80 Days,Mike McGranaghan,False,Rotten,Rotten,2004,The style of humor - with its forced high jinks and pathetic attempts at farce - is so aggressively outrageous that it ultimately becomes abusive to the audience.,male,"['Action & Adventure', 'Comedy', 'Kids & Family']","{'neg': 0.48, 'neu': 0.468, 'pos': 0.052, 'compound': -0.9543}",-0.9543
m/cheaper_by_the_dozen,Cheaper by the Dozen,Dustin Putman,False,Rotten,Rotten,2003,"Syrupy, dumb, and desperately unfunny...Cheaper by the Dozen is the worst family film of the year, a sub-sitcom-level failure as abhorrent as it is half-baked.",male,"['Comedy', 'Kids & Family']","{'neg': 0.478, 'neu': 0.522, 'pos': 0.0, 'compound': -0.9545}",-0.9545
m/alexander_and_the_terrible_horrible_no_good_very_bad_day,"Alexander and the Terrible, Horrible, No Good, Very Bad Day",Kyle Smith,True,Fresh,Rotten,2014,"Can a series of irritating events make a movie? Yes, but an irritating one: ""Alexander and the Terrible, Horrible, No Good, Very Bad Day.""",mostly_female,['Kids & Family'],"{'neg': 0.537, 'neu': 0.329, 'pos': 0.134, 'compound': -0.9595}",-0.9595
m/bratz_the_movie,Bratz: The Movie,Eric D. Snider,False,Rotten,Rotten,2007,"Bad not for its message or values, but for simply being a flat-out awful abortive trainwreck of a disastrous pile of worthless stupid garbage of an utter mess of a movie, even by the low, low standards of Movies Based on Toys.",male,"['Comedy', 'Kids & Family']","{'neg': 0.473, 'neu': 0.496, 'pos': 0.031, 'compound': -0.9813}",-0.9813
